tblCodeID,Code,Description,tblCodeTypeID,CodeType,Created,Modified,Deprecated
145069,451,University of Liège, Laboratory of Oceanology, Chemical Oceanography Unit,1398,EDMO,2015-02-06,2020-12-05,False
156249,4510,ALS Scandinavia, Lulea,1398,EDMO,2016-04-08,2020-12-05,False
156262,4511,Sheringham Shoal Offshore Wind Farm (Sheringham Shoal),1398,EDMO,2016-04-14,2020-09-28,False
156270,4512,Sydney Water,1398,EDMO,2016-04-16,2020-09-28,False
156353,4513,Mediterranean Institute Of Oceanography, Noumea (UMR 235 MIO),1398,EDMO,2016-05-12,2020-12-05,False
156373,4514,Centre for Maritime Research and Experimentation (CMRE),1398,EDMO,2016-05-24,2020-09-28,False
156369,4515,ENSTA Paristech,1398,EDMO,2016-05-21,2020-09-28,False
156370,4516,Marine Robotics Innovation centre,1398,EDMO,2016-05-21,2020-09-28,False
156374,4517,Department of Agriculture, Environment and Rural Affairs (DAERA),1398,EDMO,2016-05-24,2020-09-28,False
156551,4518,Natural England – Marine Evidence Team,1398,EDMO,2016-06-01,2021-06-08,False
156561,4519,National Institute for Earth Sciences Endoume (INSUE),1398,EDMO,2016-06-09,2016-06-09,False
156562,4520,Schapi (Schapi),1398,EDMO,2016-06-09,2020-09-28,False
156563,4521,Departmental Divisions of the Territories and the Sea (DDTM),1398,EDMO,2016-06-09,2020-09-28,False
156564,4522,Laboratory of study of the marine bio-indicators (LEBIM),1398,EDMO,2016-06-09,2020-09-28,False
156565,4523,IFREMER, Environmental Resources Laboratory Morbihan, Pays De La Loire, NANTES (LERMPL),1398,EDMO,2016-06-09,2020-12-05,False
156566,4524,Departmental Laboratory of Drôme,1398,EDMO,2016-06-09,2020-09-28,False
156567,4525,Labocea (Labocea),1398,EDMO,2016-06-09,2020-09-28,False
156568,4526,CIRAD (CIRAD),1398,EDMO,2016-06-09,2020-09-28,False
156632,4527,Blue Ocean Monitoring Pty Ltd,1398,EDMO,2016-06-15,2020-09-28,False
156633,4528,National Institute for Environmental Studies  (NIES),1398,EDMO,2016-06-15,2020-11-03,False
156634,4529,ARCADIS,1398,EDMO,2016-06-15,2020-09-28,False
156652,4530,COGEA SRL, Business Management Consultants (COGEA),1398,EDMO,2016-06-18,2020-12-05,False
156684,4531,Eaufrance,1398,EDMO,2016-06-25,2020-09-28,False
156685,4532,Cerema, Technical Direction Water, Sea And Rivers, Bonneuil,1398,EDMO,2016-06-25,2020-12-05,False
156686,4533,Centre for Studies and Expertise on Risks, the Environment, Mobility and Urban Planning, Technical Direction Water, Sea And Rivers, Plouzane (CEREMA),1398,EDMO,2016-06-25,2021-04-23,False
156697,4534,Leibniz Institute, German Collection of Microorganisms and Cell Cultures (DSMZ),1398,EDMO,2016-07-02,2020-12-05,False
156698,4535,Helmholtz Centre for Infection Research (HZI),1398,EDMO,2016-07-02,2020-09-28,False
156699,4536,Ocean Physics and Satellite oceanography laboratory- UMR 6523 (LOPS),1398,EDMO,2016-07-02,2020-09-28,False
156700,4537,ORION (ORION),1398,EDMO,2016-07-02,2020-09-28,False
156713,4538,Colin Moore,1398,EDMO,2016-07-05,2020-09-28,False
156720,4539,University of Sheffield Department of Geography,1398,EDMO,2016-07-06,2020-09-28,False
156721,4540,Ocean University of China, Department of Ocean Engineering,1398,EDMO,2016-07-06,2020-09-28,False
156760,4541,University of Cambridge Department of Physics,1398,EDMO,2016-07-13,2020-09-28,False
156765,4542,XYZH Hydrographic (XYZH),1398,EDMO,2016-07-15,2020-09-28,False
156787,4543,Environment Agency, National Laboratory Service, Leeds Laboratory (EA - NLS Leeds Laboratory),1398,EDMO,2016-07-19,2020-12-05,False
156788,4544,Environment Agency, National Laboratory Service, Nottingham Laboratory (EA - NLS Nottingham Laboratory),1398,EDMO,2016-07-19,2020-12-05,False
156789,4545,Environment Agency, National Laboratory Service, Llanelli Laboratory (EA - NLS Llanelli Laboratory),1398,EDMO,2016-07-19,2020-12-05,True
156790,4546,Natural Resources Wales Laboratory (NRW Llanelli Laboratory),1398,EDMO,2016-07-19,2020-09-28,False
156791,4547,Environment Agency South West Regional Office (EA South West Regional Office),1398,EDMO,2016-07-19,2020-09-28,False
156820,4548,Environment Agency North West Regional Office (EA North West Regional Office),1398,EDMO,2016-07-20,2020-09-28,False
156821,4549,Environments for People,1398,EDMO,2016-07-20,2020-09-28,False
156822,4550,Clinton Marine Survey AB,1398,EDMO,2016-07-20,2020-09-28,False
156906,4551,Environment Agency South East Regional Office (EA South East Regional Office),1398,EDMO,2016-07-23,2020-09-28,False
156907,4552,Environment Agency Solent and South Downs Area Office (EA Solent and South Downs Area Office),1398,EDMO,2016-07-23,2020-09-28,False
156908,4553,Scottish Environment Protection Agency, Aberdeen Office (SEPA),1398,EDMO,2016-07-23,2020-09-28,False
156909,4554,Scottish Environment Protection Agency, Angus Smith Building (SEPA),1398,EDMO,2016-07-23,2020-09-28,False
156910,4555,Scottish Environment Protection Agency, East Kilbride Office (SEPA),1398,EDMO,2016-07-23,2020-09-28,True
156911,4556,Scottish Environment Protection Agency, Perth (Strathearn House) Office (SEPA),1398,EDMO,2016-07-23,2020-09-28,False
156918,4557,Deep BV, Hydrography and Geophysics (Deep BV),1398,EDMO,2016-08-03,2020-09-28,False
156919,4558,The Marine Environment Monitoring and Assessment National database (MERMAN),1398,EDMO,2016-08-03,2020-09-28,False
156920,4559,University of Innsbruck,1398,EDMO,2016-08-03,2020-09-28,False
156921,4560,The Council for Geoscience (CGS),1398,EDMO,2016-08-03,2020-09-28,False
156922,4561,Acadia University, Acadia Centre for Estuarine Research (ACER),1398,EDMO,2016-08-03,2020-12-05,False
156923,4562,Acadia University, Department of Biology,1398,EDMO,2016-08-05,2020-12-05,False
156940,4563,Department of the Environment (Northern Ireland) (DOE-NI),1398,EDMO,2016-08-12,2020-09-28,True
168039,4564,Laboratory of Dept of Environmental Sciences, Helsinki University,1398,EDMO,2016-09-05,2020-09-28,False
168040,4565,Pöyry Finland,1398,EDMO,2016-09-05,2020-09-28,False
168041,4566,Nab Labs, Jyväskylä laboratory,1398,EDMO,2016-09-05,2020-09-28,False
168042,4567,The Association for Water and Environment of Kymijoki region,1398,EDMO,2016-09-05,2020-09-28,False
168043,4568,Nab Labs, Oulu laboratory,1398,EDMO,2016-09-05,2020-09-28,False
168044,4569,Natural Resources Institute Finland, Turku Laboratory,1398,EDMO,2016-09-05,2020-09-28,False
145070,457,Agency for Water and Nature Management,1398,EDMO,2015-02-06,2020-09-28,False
168045,4570,The Association for Water and Environment of Western Uusimaa (LUVY),1398,EDMO,2016-09-05,2020-09-28,False
168046,4571,The National Institute for Health and Welfare (THL),1398,EDMO,2016-09-05,2020-09-28,False
168047,4572,Kala- ja vesitutkimus Ltd,1398,EDMO,2016-09-05,2020-09-28,False
168048,4573,Finnish Food Safety Authority (EVIRA),1398,EDMO,2016-09-05,2020-09-28,False
167797,4574,University of Bolton, Bolton Business School (Bolton Business School),1398,EDMO,2016-08-20,2020-09-28,False
167829,4575,Siem Offshore Contractors GmbH (SOC),1398,EDMO,2016-08-24,2020-09-28,False
167857,4576,Baker Consultants,1398,EDMO,2016-08-26,2020-09-28,False
168093,4577,Maritime Archaeology Ltd,1398,EDMO,2016-09-07,2020-09-28,False
168121,4578,Institute of Microbiology and Genetics (GZMB),1398,EDMO,2016-09-14,2020-09-28,False
168213,4579,Laboratory Of Oceanology And Geosciences, UMR 8187 (LOG),1398,EDMO,2016-09-22,2020-12-05,False
168528,4580,MARine Biodiversity, Exploitation and Conservation, UMR, SAINTE-CLOTILDE (MARBEC),1398,EDMO,2016-10-18,2020-12-05,False
168529,4581,Uniper Technologies Limited, Technology Centre  (Uniper Technologies),1398,EDMO,2016-10-18,2020-09-28,False
168530,4582,Historic England, London,1398,EDMO,2016-10-18,2021-01-28,False
168531,4583,GEOxyz, United Kingdom Office (GEOxyz),1398,EDMO,2016-10-19,2020-12-05,False
168553,4584,Department of Labour Inspection, Ministry of Labour and Social Insurance,1398,EDMO,2016-10-20,2020-09-28,False
168666,4585,EuroGOOS AISBL,1398,EDMO,2016-10-29,2020-09-28,False
168630,4586,Greek Research and Technology Network (GRNET),1398,EDMO,2016-10-28,2020-09-28,False
169603,4587,The German Climate Computing Center (DKRZ),1398,EDMO,2017-02-10,2020-09-28,False
168631,4588,Jcomm In-Situ Observations Programme Support Centre (Jcommops
),1398,EDMO,2016-10-28,2020-09-28,False
168676,4589,Animal and Plant Health Agency (APHA),1398,EDMO,2016-11-03,2020-09-28,False
168861,4590,St. Francis Xavier University, Department of Biology,1398,EDMO,2016-11-11,2020-12-05,False
168862,4591,Memorial University of Newfoundland, Department of Biology (MUN),1398,EDMO,2016-11-11,2020-12-05,False
168712,4592,CNRS, Labo Interuniversitaire des Systèmes Atmosphériques  (LISA),1398,EDMO,2016-11-04,2020-12-05,False
168713,4593,Aberdeen Offshore Wind Farm Limited (AOWFL),1398,EDMO,2016-11-04,2020-09-28,False
168863,4594,UTEC (Corporate Headquarters) (UTEC),1398,EDMO,2016-11-11,2020-09-28,False
168902,4595,University of Bergen, Geophysical Institute,1398,EDMO,2016-11-16,2020-12-05,False
168903,4596,University of Gothenburg, Department of Chemistry,1398,EDMO,2016-11-17,2020-09-28,False
168947,4597,University of New Hampshire, Institute for the Study of Earth, Oceans & Space,1398,EDMO,2016-12-06,2020-09-28,False
168940,4598,Princeton University, Department of Atmospheric and Oceanic Sciences,1398,EDMO,2016-12-03,2020-09-28,False
168941,4599,University of Hawaii, Department of Oceanography,1398,EDMO,2016-12-03,2020-09-28,False
144740,46,Permanent Service for Mean Sea Level (PSMSL),1398,EDMO,2015-02-06,2020-09-28,False
168942,4600,University of Montana, Department of Chemistry,1398,EDMO,2016-12-03,2020-09-28,False
168943,4601,Hawai‘i Pacific University (HPU),1398,EDMO,2016-12-03,2020-09-28,False
168944,4602,NOAA Earth System Research Laboratory (NOAA ESRL),1398,EDMO,2016-12-03,2020-09-28,False
168896,4603,University of Otago, Department of Chemistry,1398,EDMO,2016-11-15,2020-09-28,False
168897,4604,National Research Institute for Fisheries Science, Fisheries Research Agency,1398,EDMO,2016-11-15,2020-09-28,False
168898,4605,Council for Scientific and Industrial Research Natural Resources and Environment (CSIR-NRE),1398,EDMO,2016-11-15,2020-09-28,False
168914,4606,IFREMER, ENVIRONMENT RESOURCES LABORATORY PROVENCE AZUR CORSICA , LA SEYNE-SUR-MER (LERPAC
),1398,EDMO,2016-11-19,2020-12-05,False
168915,4607,IFREMER, Underwater Systems Unit, La Seyne (SM),1398,EDMO,2016-11-19,2020-12-05,False
168918,4608,Instituto National de Investigacao Pesqueira,1398,EDMO,2016-11-23,2020-09-28,False
168919,4609,Directorate-General  for Territorial Development,1398,EDMO,2016-11-23,2020-09-28,False
168948,4610,Sea Directorate Of Guyana,1398,EDMO,2016-12-06,2020-09-28,False
168949,4611,Guadeloupe Large Seaport,1398,EDMO,2016-12-06,2020-09-28,False
168950,4612,Pau and Pays de l'Adour University (UPPA),1398,EDMO,2016-12-06,2020-09-28,False
168951,4613,Associated Norman Ports (PNA),1398,EDMO,2016-12-06,2020-09-28,False
168952,4614,ERIC Euro-Argo,1398,EDMO,2016-12-06,2020-09-28,False
168953,4615,DREAL Nord-Pas-De-Calais,1398,EDMO,2016-12-06,2020-09-28,False
168954,4616,Bureau of Enquiry and Analysis for Civil Aviation Safety (BEA),1398,EDMO,2016-12-06,2020-09-28,False
168955,4617,DREAL Languedoc-Roussillon-Midi-Pyrénées,1398,EDMO,2016-12-06,2020-09-28,False
168956,4618,ECN, Ecole Centrale Nantes,1398,EDMO,2016-12-06,2020-12-05,False
168945,4619,CALLUNA AB (CALLUNA),1398,EDMO,2016-12-03,2020-09-28,False
168946,4620,Svenska ALcontrol AB (ALcontrol),1398,EDMO,2016-12-03,2020-09-28,True
168959,4621,Dalhousie University, Department of Earth Sciences,1398,EDMO,2016-12-08,2020-12-05,False
168960,4622,The Rooms Corporation of Newfoundland and Labrador, Provincial Museum Division,1398,EDMO,2016-12-08,2020-12-05,False
168966,4623,HydroGIS AB (HydroGIS),1398,EDMO,2016-12-10,2020-09-28,False
168962,4624,Naturvatten Roslagen AB,1398,EDMO,2016-12-09,2020-09-28,False
169010,4625,Mediterranean Institute Of Oceanography, UMR 7294 UMR IRD 235, TOULON (MIO),1398,EDMO,2016-12-24,2020-12-05,False
169011,4626,DEAL Guyana (DEAL),1398,EDMO,2016-12-24,2020-09-28,False
169012,4627,DTAM St-Pierre et Miquelon,1398,EDMO,2016-12-24,2020-09-28,False
169709,4628,CLS America (CLS-A),1398,EDMO,2017-03-21,2020-09-28,False
169710,4629,Naval Research Laboratory: Marine Meteorology Division (NRL-MRY),1398,EDMO,2017-03-21,2020-09-28,False
145071,463,Maersk Oil and Gas AS,1398,EDMO,2015-02-06,2020-09-28,False
169711,4630,CORIOLIS (CORIOLIS),1398,EDMO,2017-03-21,2021-04-29,False
169467,4631,Meteorological Research Institute, Japan Meteorological Agency (JMA/MRI),1398,EDMO,2017-01-10,2020-09-28,False
169468,4632,Centre for Atmospheric and Oceanic Sciences, Indian Institute of Science (IISC/CAOS),1398,EDMO,2017-01-10,2020-09-28,False
169469,4633,State Oceanic Administration (SOA),1398,EDMO,2017-01-10,2021-01-30,True
169470,4634,The Tsurumi Seiki Co., Ltd,1398,EDMO,2017-01-10,2020-09-28,False
169471,4635,Meteorological Research Institute, Korea Meteorological Administration (KMA/NIMS),1398,EDMO,2017-01-10,2020-09-28,False
169472,4636,Cubic-i Ltd.,1398,EDMO,2017-01-10,2020-09-28,False
169473,4637,South African National Antarctic Programme (SANAP),1398,EDMO,2017-01-10,2020-09-28,False
169712,4638,Niels Bohr Institute (NBI),1398,EDMO,2017-03-21,2020-09-28,False
169474,4639,South African Environmental Observation Network (SAEON),1398,EDMO,2017-01-10,2020-09-28,False
145072,464,Fisheries Laboratory, Faroe Islands,1398,EDMO,2015-02-06,2020-09-28,False
169475,4640,First Institute of Oceanography, Ministry of Natural Resources (FIO, NMR),1398,EDMO,2017-01-10,2020-11-26,False
169476,4641,Japan Fisheries Agency (JFA),1398,EDMO,2017-01-10,2020-09-28,False
169493,4642,National Research Council Canada, Atlantic Regional Laboratory,1398,EDMO,2017-01-18,2020-12-05,False
169477,4643,Maritime Spatial Planning (Department of Housing, Planning, and Local Government) (MSP DHPLG),1398,EDMO,2017-01-12,2020-09-28,False
169618,4645,University of Prince Edward Island, Department of Biology (UPEI),1398,EDMO,2017-02-14,2020-12-05,False
169537,4646,Titan Environmental Surveys Ltd,1398,EDMO,2017-02-02,2020-09-28,False
169587,4647,CNR, Institute of Atmospheric Pollution Research, Florence (CNR - IIA),1398,EDMO,2017-02-07,2020-12-24,False
169601,4648,Scottish Fishermen’s Federation (SFF),1398,EDMO,2017-02-08,2020-09-28,False
169602,4649,University of Southampton Engineering and the Environment,1398,EDMO,2017-02-08,2020-09-28,False
145073,465,Royal Danish Administration of Navigation & Hydrography, Hydrographic Department,1398,EDMO,2015-02-06,2020-09-28,True
169604,4650,Aalto University,1398,EDMO,2017-02-11,2020-09-28,False
169605,4651,CSC, IT Center for Science Ltd. (CSC),1398,EDMO,2017-02-11,2020-12-05,False
169628,4652,Institut für technische und angewandte Physik GmbH (itap GmbH),1398,EDMO,2017-02-21,2020-09-28,False
169629,4653,Geomara,1398,EDMO,2017-02-21,2020-09-28,False
169630,4654,Peel Ports Group Ltd (Peel Ports),1398,EDMO,2017-02-21,2020-09-28,False
169631,4655,Jan De Nul Luxembourg S.A.,1398,EDMO,2017-02-21,2020-09-28,False
169637,4656,Historic Environment Scotland (HES),1398,EDMO,2017-02-25,2020-09-28,False
169661,4657,Dalhousie University, Department of Biology,1398,EDMO,2017-03-01,2020-12-05,False
169662,4658,McGill University, Department of Biology,1398,EDMO,2017-03-01,2020-12-05,False
169657,4659,Periplus Group (Periplus),1398,EDMO,2017-02-28,2020-09-28,False
145074,466,Danish Coastal Authority, Ministry of Transport and Energy,1398,EDMO,2015-02-06,2020-09-28,False
169674,4660,INSTITUTE OF SYSTEMATICS, EVOLUTION, BIODIVERSITY, UMR 7205, PARIS (ISYEB),1398,EDMO,2017-03-15,2020-12-05,False
169675,4661,Department of Agriculture and Water Resources, Australian Government (DAWR),1398,EDMO,2017-03-15,2020-09-28,False
169676,4662,Department of Industry, Innovation and Science, Australian Government,1398,EDMO,2017-03-15,2020-09-28,False
169677,4663,Department of the Environment and Energy, Australian Government,1398,EDMO,2017-03-15,2020-09-28,False
169700,4664,CNR, Institute for the Marine and Coastal Environment (IAMC) - Napoli (IAMC-CNR),1398,EDMO,2017-03-19,2017-03-19,False
169701,4665,Maritime Administration of Latvia (MAL),1398,EDMO,2017-03-19,2020-09-28,False
169702,4666,Geodetic Institute of Slovenia (GIS),1398,EDMO,2017-03-19,2020-09-28,False
169703,4667,EOMAP GmbH & Co KG (EOMAP),1398,EDMO,2017-03-19,2020-09-28,False
169704,4668,Danish Maritime Authority (DMA),1398,EDMO,2017-03-19,2020-09-28,False
169705,4669,Danish Geodata Agency, Danish Hydrographic Office (GST),1398,EDMO,2017-03-19,2020-12-05,False
169706,4670,Coronis Computing SL (Coronis),1398,EDMO,2017-03-19,2020-09-28,False
169779,4671,Department of Geology, Geophysics and Coastal Processes, Israel Oceanographic & Limnological Research. (IOLR),1398,EDMO,2017-03-28,2020-12-05,False
169787,4672,Technological Educational Institute of Ionian Islands, School of Applied Technologies, Department of Environmental Technology and Ecology,1398,EDMO,2017-03-30,2020-09-28,False
169808,4673,River Basin Community Elbe (FGG Elbe),1398,EDMO,2017-04-06,2020-09-28,False
169790,4674,Latvian Ornithological Society (LOB),1398,EDMO,2017-04-01,2020-09-28,False
169791,4675,Society "Friends of the Earth",1398,EDMO,2017-04-01,2020-09-28,False
169792,4676,The State Environmental Service of the Republic of Latvia (VVD),1398,EDMO,2017-04-01,2020-09-28,False
169795,4677,Laboratoire Dynamique Hydro-Sédimentaire (Dyneco / Dhysed ),1398,EDMO,2017-04-04,2020-09-28,False
169809,4678,Ramboll Analytics,1398,EDMO,2017-04-06,2020-09-28,False
171126,4679,Eurofins Scientific,1398,EDMO,2017-06-03,2020-09-28,False
145075,468,Royal Danish Administration of Navigation & Hydrography, Oceanographic Department,1398,EDMO,2015-02-06,2020-09-28,True
169810,4680,Ålands landskapsregering,1398,EDMO,2017-04-06,2020-09-28,False
169815,4681,MNAS-ARQUA, National Museum of Underwater Archaeology (MNAS-ARQUA),1398,EDMO,2017-04-13,2020-12-15,False
169856,4682,Kenneth Pye Associates Ltd,1398,EDMO,2017-04-21,2020-09-28,False
169857,4683,RSS Marine Ltd,1398,EDMO,2017-04-21,2020-09-28,True
169869,4684,Ahma Group Rovaniemi,1398,EDMO,2017-04-29,2020-09-28,False
169953,4685,North Devon Area of Outstanding Natural Beauty  (AONB),1398,EDMO,2017-05-13,2020-11-03,False
169954,4686,Coastwise North Devon,1398,EDMO,2017-05-13,2020-09-28,False
171046,4687,Blom Aerofilms Limited,1398,EDMO,2017-05-24,2020-09-28,False
171047,4688,Gas Transmission Operator GAZ-SYSTEM S.A. (GAZ-SYSTEM),1398,EDMO,2017-05-24,2020-09-28,False
171048,4689,Geo Ingenieurservice Ost GmbH & Co. KG (GEO Group),1398,EDMO,2017-05-24,2020-09-28,False
145076,469,Danish Meteorological Institute, Oceanographic Section,1398,EDMO,2015-02-06,2020-09-28,False
171055,4690,Secora AS,1398,EDMO,2017-05-30,2020-09-28,False
171127,4691,Department of Biology, University of Bergen,1398,EDMO,2017-06-03,2020-12-05,False
171071,4692,Ramboll Denmark A/S,1398,EDMO,2017-05-31,2020-09-28,False
171072,4693,Rohde Nielsen A/S,1398,EDMO,2017-05-31,2020-09-28,False
202078,4694,Aga Gas AB,1398,EDMO,2020-02-06,2020-09-28,False
202079,4695,Airborne Hydrography AB (AHAB) (AHAB),1398,EDMO,2020-02-06,2020-09-28,True
202080,4696,Boskalis Sweden AB,1398,EDMO,2020-02-06,2020-09-28,False
202081,4697,Caliterra AB,1398,EDMO,2020-02-06,2020-09-28,False
202082,4698,Cementa AB,1398,EDMO,2020-02-06,2020-09-28,False
202083,4699,Dyk & Sjotjanst i Uddevalla AB,1398,EDMO,2020-02-06,2020-09-28,True
144741,47,Plymouth Marine Laboratory (PML),1398,EDMO,2015-02-06,2020-09-28,False
202084,4700,Dykma AB,1398,EDMO,2020-02-06,2020-09-28,True
202085,4701,ENVIPRO Miljoteknik AB,1398,EDMO,2020-02-06,2020-09-28,True
202086,4702,Gps Marinkonsult AB,1398,EDMO,2020-02-06,2020-09-28,False
202087,4703,Hydrographica,1398,EDMO,2020-02-06,2020-09-28,False
171225,4704,Jan Andersson Dykeri AB,1398,EDMO,2017-06-15,2020-09-28,False
171226,4705,MarCon (MarCon),1398,EDMO,2017-06-15,2020-09-28,False
171227,4706,Marin Miljoanalys AB (MMA),1398,EDMO,2017-06-15,2020-09-28,False
171228,4707,Norrlands Sjoentreprenad (NSE) (NSE),1398,EDMO,2017-06-15,2020-09-28,False
171229,4708,SB Consulting,1398,EDMO,2017-06-15,2020-09-28,False
171230,4709,Skanska Sverige,1398,EDMO,2017-06-15,2020-09-28,False
171231,4710,Skog & Sjo i Dalarna,1398,EDMO,2017-06-15,2020-09-28,False
171232,4711,Stora Enso AB,1398,EDMO,2017-06-15,2020-09-28,False
171233,4712,Sundlink Contractors HB,1398,EDMO,2017-06-15,2020-09-28,False
171234,4713,SUB, Svensk Undervattens Besiktning HB (SUB HB),1398,EDMO,2017-06-15,2020-12-05,False
171235,4714,Tugab Construction AB,1398,EDMO,2017-06-15,2020-09-28,False
171236,4715,Scandiakonsult,1398,EDMO,2017-06-15,2020-09-28,True
171237,4716,Waxholms Angfartygs AB,1398,EDMO,2017-06-15,2020-09-28,False
171238,4717,Yoldia Enviralmental Consulting AB,1398,EDMO,2017-06-15,2020-09-28,False
171239,4718,Svensk-Danska Broforbindelsen SVEDAB AB (OSK),1398,EDMO,2017-06-15,2020-09-28,False
171128,4719,Civil Tech Oy Ab,1398,EDMO,2017-06-03,2020-09-28,False
171129,4720,Finnish Transport Agency (FTA) (FTA),1398,EDMO,2017-06-03,2020-09-28,False
171130,4721,Geotec OY (Geotec),1398,EDMO,2017-06-03,2020-09-28,False
171131,4722,Oy Mapteam Ab,1398,EDMO,2017-06-03,2020-09-28,False
171132,4723,Meritaito Oy,1398,EDMO,2017-06-03,2020-09-28,False
171133,4724,Terramare OY,1398,EDMO,2017-06-03,2020-09-28,False
171134,4725,Van Oord dredging and marine contractors,1398,EDMO,2017-06-07,2020-09-28,False
171135,4726,Group on Earth Observations (GEO),1398,EDMO,2017-06-07,2020-09-28,False
171240,4727,NGO MARINE SOUND,1398,EDMO,2017-06-15,2020-09-28,False
194299,4728,NGO for Sustainable Regional Development and Environmental Protection,1398,EDMO,2017-07-18,2020-09-28,False
194300,4729,Black Sea-Danube Coastal Association for Research and Development (BDCA),1398,EDMO,2017-07-18,2020-09-28,False
194301,4730,GeoMarine Ltd.,1398,EDMO,2017-07-18,2020-09-28,False
194302,4731,National Agency for Fisheries and Aquaculture (NAFA),1398,EDMO,2017-07-18,2020-09-28,False
194303,4732,Marine Antipollution Enterprise JSCO,1398,EDMO,2017-07-18,2020-09-28,False
194237,4733,MariLim Aquatic Research GmbH (MariLim),1398,EDMO,2017-07-01,2020-09-28,False
194241,4734,University of Queensland, School of Earth and Environmental Sciences,1398,EDMO,2017-07-04,2020-09-28,False
194242,4735,University of Queensland, Remote Sensing Research Centre (RSRC),  School of Earth and Environmental Sciences (RSRC),1398,EDMO,2017-07-04,2020-09-28,False
194243,4736,Griffith University, Environmental Futures Research Institute (EFRI),1398,EDMO,2017-07-04,2020-09-28,False
194244,4737,Clean Ocean Foundation,1398,EDMO,2017-07-04,2020-09-28,False
194245,4738,Department of Environment, Water and Natural Resources (DEWNR), South Australian Government (DEWNR),1398,EDMO,2017-07-04,2020-09-28,False
194246,4739,Department of Environment and Natural Resources (DENR), Northern Territory Government (DENR),1398,EDMO,2017-07-04,2020-09-28,False
194247,4740,Department of National Parks, Sport and Racing (NPSR), Queensland Government (NPSR),1398,EDMO,2017-07-04,2020-09-28,True
194258,4741,North Atlantic Salmon Conservation Organization (NASCO),1398,EDMO,2017-07-07,2020-09-28,False
194259,4742,North East Atlantic Fisheries Commission (NEAFC),1398,EDMO,2017-07-07,2020-09-28,False
194304,4743,Varna Municipality,1398,EDMO,2017-07-18,2020-09-28,False
194305,4744,Burgas Municipality (BM),1398,EDMO,2017-07-18,2020-09-28,False
194306,4745,Faculty Of Exact Sciences And Experimental (UPVD - UFR SEE),1398,EDMO,2017-07-21,2020-09-28,False
194317,4746,DeepOcean,1398,EDMO,2017-07-25,2020-09-28,False
194523,4747,Near East University (NEU),1398,EDMO,2017-08-18,2020-09-28,False
194524,4748,University of  Kyrenia (KU),1398,EDMO,2017-08-18,2020-09-28,False
194490,4749,Mediterranean Fisheries Research, Production and Training Institute (MEDFRI),1398,EDMO,2017-08-12,2020-09-28,False
194513,4750,Water Services Corporation (WSC),1398,EDMO,2017-08-17,2020-09-28,False
194514,4751,Environment and Resources Authority (ERA),1398,EDMO,2017-08-17,2020-09-28,False
194515,4752,NexSens Technology,1398,EDMO,2017-08-17,2020-09-28,False
194516,4753,University of New South Wales (UNSW), Evolution and Ecology Research Centre  (E&ERC),1398,EDMO,2017-08-17,2020-09-28,False
194525,4754,BioConsult-SH (BioConsult),1398,EDMO,2017-08-18,2020-09-28,False
194541,4755,National Weather Service, National Oceanic and Atmospheric Administration (NOAA) (NWS),1398,EDMO,2017-08-22,2020-09-28,False
194753,4756,University of Gothenburg Loven Centre Tjarno,1398,EDMO,2017-09-19,2020-09-28,False
194727,4757,Bristol Regional Environmental Records Centre (BRERC),1398,EDMO,2017-09-12,2020-09-28,False
194732,4758,Fisheries Local Action Groups South Marche (FLAG) (FLAG / GAC),1398,EDMO,2017-09-14,2020-09-28,False
194733,4759,Cooperative Research Centre for Spatial Information (CRCSI) (CRCSI),1398,EDMO,2017-09-14,2020-09-28,False
194752,4760,Sussex Biodiversity Record Centre (SXBRC),1398,EDMO,2017-09-15,2020-09-28,False
194832,4761,Chief Inspectorate for Environmental Protection (CIEP),1398,EDMO,2017-10-17,2020-09-28,False
194788,4762,Foundation for Environmental Education, Latvia (FEE Latvia),1398,EDMO,2017-10-07,2020-12-05,False
195009,4763,Ecole Normale Superieure,1398,EDMO,2017-11-21,2020-09-28,False
194872,4764,Huntsman Marine Science Centre, Atlantic Reference Centre (ARC),1398,EDMO,2017-10-24,2020-12-05,False
194880,4765,Environmental Protection Agency (Regional Inspectorate Dublin) (EPA),1398,EDMO,2017-10-25,2020-09-28,False
194922,4766,Marine and Freshwater Research Institute (MFRI),1398,EDMO,2017-10-31,2020-09-28,False
194928,4767,Petrovic Njegos Foundation,1398,EDMO,2017-11-01,2020-09-28,False
194929,4768,County Administrative Board of Vastra Gotaland,1398,EDMO,2017-11-01,2020-09-28,False
194933,4769,UCV-IMEDMAR, Catholic University of Valencia, IMEDMAR Institute (UCV-IMEDMAR),1398,EDMO,2017-11-08,2020-12-15,False
145077,477,University of Copenhagen, Department of Biology, Phycology section,1398,EDMO,2015-02-06,2020-09-28,False
