tblCodeID,Code,Description,tblCodeTypeID,CodeType,Created,Modified,Deprecated
145953,2267,National Environmental Agency of the Ministry of Environment Protection and Natural Resources (NEA),1398,EDMO,2015-02-06,2020-09-28,False
145954,2268,Royal Belgian Institute of Natural Sciences,Department of Education and Nature,Fresh Water Biology,1398,EDMO,2015-02-06,2020-12-05,False
145955,2269,Royal Belgian Institute of Natural Sciences, Marine Ecosystem Management, Afdeling Sedimentologie,1398,EDMO,2015-02-06,2020-12-05,False
144878,227,CNR, National Research Council, Institute of Marine Science (CNR - ISMAR),1398,EDMO,2015-02-06,2020-12-24,False
145956,2270,Flemish Government, Environment, Nature and Energy, Flemish Environment Agency, Afdeling Water,1398,EDMO,2015-02-06,2020-12-05,False
145957,2271,Coördinatiepunt Duurzaam Kustbeheer,1398,EDMO,2015-02-06,2020-09-28,False
145958,2272,Flemish Ministry of Mobility and Public Works, Department of Mobility and Public Works, Flanders Hydraulics Research, Onderzoeksgroep Waterbeheer,1398,EDMO,2015-02-06,2020-12-05,False
145959,2273,Society for the Management of Electronic Biodiversity Data,1398,EDMO,2015-02-06,2020-09-28,True
145960,2274,National Museum Wales,1398,EDMO,2015-02-06,2020-09-28,False
145961,2275,Geological Institute, Russian Academy of Sciences,1398,EDMO,2015-02-06,2020-09-28,False
145962,2276,National Institute of Oceanography and Applied Geophysics - OGS,  Infrastructures Division,1398,EDMO,2015-02-06,2021-05-14,False
145963,2277,Vlaams Instituut voor het Onroerend Erfgoed, Afdeling Onderzoek,  Maritieme Archeologie en Varend Erfgoed (AOE),1398,EDMO,2015-02-06,2020-12-05,False
145964,2278,National Office for Cultural Heritage,1398,EDMO,2015-02-06,2020-09-28,False
145965,2279,Dalhousie University, Department of Oceanography,1398,EDMO,2015-02-06,2020-12-05,False
144879,228,University of Mons-Hainaut, Laboratory of Organic Chemistry,1398,EDMO,2015-02-06,2020-09-28,False
145966,2280,Hartley Anderson,1398,EDMO,2015-02-06,2020-09-28,False
145967,2281,ATLIS (ATLIS),1398,EDMO,2015-02-06,2020-09-28,True
145968,2283,SIMRAD, Kongsberg Maritime AS,1398,EDMO,2015-02-06,2020-09-28,False
145969,2284,New Zealand National Institute of Water & Atmospheric Research, Christchurch,1398,EDMO,2015-02-06,2020-09-28,False
145970,2285,New Zealand National Institute of Water & Atmospheric Research, Dunedin,1398,EDMO,2015-02-06,2020-09-28,False
145971,2286,New Zealand National Institute of Water & Atmospheric Research, University of Otago Centre for Chemical and Physical Oceanography,1398,EDMO,2015-02-06,2020-09-28,False
145972,2287,Institute of Hydrometeorology, Department of Hydrology,1398,EDMO,2015-02-06,2020-09-28,True
145973,2288,Academy of Finland,1398,EDMO,2015-02-06,2020-09-28,False
145974,2289,Black Sea Hydrometeorological Observatory,1398,EDMO,2015-02-06,2020-09-28,True
144880,229,Université Libre de Bruxelles, Marine Biology Laboratory (BIOMAR),1398,EDMO,2015-02-06,2020-09-28,False
145975,2290,Zoological Society of London, Institute of Zoology (ZSL),1398,EDMO,2015-02-06,2020-09-28,False
145976,2291,Aberdeen Coastguard,1398,EDMO,2015-02-06,2020-09-28,False
145977,2292,Biological Institute Helgoland,1398,EDMO,2015-02-06,2020-09-28,True
145978,2293,Federal Research Institute of Nutrition and Food,1398,EDMO,2015-02-06,2020-09-28,True
145979,2294,German Weather Service, Meteorological Observatory, Hamburg,1398,EDMO,2015-02-06,2020-09-28,False
145980,2295,German Weather Service, Maritime Weather Office Hamburg,1398,EDMO,2015-02-06,2020-09-28,False
145981,2296,DLR, German Aerospace Center,1398,EDMO,2015-02-06,2020-12-05,False
145982,2297,University of Tuebingen,1398,EDMO,2015-02-06,2020-09-28,False
145983,2298,Aachen University of Applied Sciences, Campus Juelich,1398,EDMO,2015-02-06,2020-09-28,False
145984,2299,Research and Technology Centre , Buesum (FTZ),1398,EDMO,2015-02-06,2020-11-03,False
144717,23,Cunninghame District Council,1398,EDMO,2015-02-06,2020-09-28,False
144881,230,Ghent University, Faculty of Sciences, Department Geology and Soil Science, Renard Centre of Marine Geology (RCMG),1398,EDMO,2015-02-06,2020-12-05,False
145985,2300,GFZ German Research Centre for Geosciences,1398,EDMO,2015-02-06,2020-09-28,False
145986,2301,Institute for Aquatic Measuring Technique, Petersdorf,1398,EDMO,2015-02-06,2020-09-28,False
145987,2302,Institute for Marine Science (IGDR),1398,EDMO,2015-02-06,2020-11-03,True
145988,2303,Department of Safety and Quality of Milk and Fish Products (Max Rubner),1398,EDMO,2015-02-06,2020-09-28,False
145989,2304,Institute of Environmental Physics, University of Heidelberg,1398,EDMO,2015-02-06,2020-09-28,False
145990,2305,Jacobs University Bremen, School of Engineering and Science,1398,EDMO,2015-02-06,2020-09-28,False
145991,2306,State Office for the Preservation and Care of Field Monuments,1398,EDMO,2015-02-06,2020-09-28,False
145992,2307,State Office for Agriculture, Food safety and Fishery  (LALLF M-V),1398,EDMO,2015-02-06,2020-11-03,False
145993,2308,Ludwig-Maximilians-University of Munich,1398,EDMO,2015-02-06,2020-09-28,False
145994,2309,Federal Research Institute of Nutrition and Food (Max Rubner),1398,EDMO,2015-02-06,2020-09-28,False
144882,231,Ghent University, Laboratory for Aquaculture & Artemia Reference Center,1398,EDMO,2015-02-06,2020-12-05,False
145995,2310,Berlin Museum of Natural History,1398,EDMO,2015-02-06,2020-09-28,False
145996,2311,RWTH Aachen University,1398,EDMO,2015-02-06,2020-09-28,False
145997,2312,University of Rostock, Institute of Aquatic Ecology,1398,EDMO,2015-02-06,2020-09-28,False
145998,2313,Waterways and Shipping Authority Lübeck (WSA Lübeck),1398,EDMO,2015-02-06,2020-09-28,False
145999,2314,Waterways and Shipping Authority Wilhelmshaven,1398,EDMO,2015-02-06,2020-09-28,False
146000,2316,Institute of Zoology and Zoological Museum of the University of Hamburg,1398,EDMO,2015-02-06,2020-09-28,False
146001,2317,Agency for Archaeology, Mecklenburg-Vorpommern, Luebstorf,1398,EDMO,2015-02-06,2020-09-28,False
146002,2318,Max Planck Institute for Chemistry, Mainz,1398,EDMO,2015-02-06,2020-09-28,False
146003,2319,Innomar Technologie GmbH,1398,EDMO,2015-02-06,2020-09-28,False
146004,2320,Technical University of Dresden,1398,EDMO,2015-02-06,2020-09-28,False
146005,2321,Petroleum Agency South Africa,1398,EDMO,2015-02-06,2020-09-28,False
146006,2322,Belfast Coastguard,1398,EDMO,2015-02-06,2020-09-28,False
146007,2323,Brixham Coastguard,1398,EDMO,2015-02-06,2020-09-28,False
146008,2324,Clyde Coastguard,1398,EDMO,2015-02-06,2020-09-28,False
146009,2325,Dover Coastguard,1398,EDMO,2015-02-06,2020-09-28,False
146010,2326,Falmouth Coastguard,1398,EDMO,2015-02-06,2020-09-28,False
146011,2327,Forth Coastguard,1398,EDMO,2015-02-06,2020-09-28,False
146012,2328,Holyhead Coastguard,1398,EDMO,2015-02-06,2020-09-28,False
146013,2329,Humber Coastguard,1398,EDMO,2015-02-06,2020-09-28,False
146014,2330,Liverpool Coastguard,1398,EDMO,2015-02-06,2020-09-28,False
146015,2331,London Coastguard,1398,EDMO,2015-02-06,2020-09-28,False
146016,2332,Milford-Haven Coastguard,1398,EDMO,2015-02-06,2020-09-28,False
146017,2333,Portland Coastguard,1398,EDMO,2015-02-06,2020-09-28,False
146018,2334,Shetland Coastguard,1398,EDMO,2015-02-06,2020-09-28,False
146019,2335,Solent Coastguard,1398,EDMO,2015-02-06,2020-09-28,False
146020,2336,Stornoway Coastguard,1398,EDMO,2015-02-06,2020-09-28,False
146021,2337,Swansea Coastguard,1398,EDMO,2015-02-06,2020-09-28,False
146022,2338,Thames Coastguard,1398,EDMO,2015-02-06,2020-09-28,False
146023,2339,Yarmouth Coastguard,1398,EDMO,2015-02-06,2020-09-28,False
144883,234,Università degli Studi di Napoli 'Parthenope', Istituto di Meteorologia e Oceanografia,1398,EDMO,2015-02-06,2020-12-05,False
146024,2340,Analytical and Environmental Services Ltd (AES),1398,EDMO,2015-02-06,2020-09-28,False
149760,2341,Aberdeen University Research and Industrial Services Ltd (AURIS),1398,EDMO,2015-05-04,2020-09-28,False
197198,2342,Andrews Survey,1398,EDMO,2018-08-31,2020-09-28,False
146025,2343,Anglian Water,1398,EDMO,2015-02-06,2020-09-28,False
146026,2346,CEMEX UK,1398,EDMO,2015-02-06,2020-09-28,False
146027,2347,Christchurch Borough Council,1398,EDMO,2015-02-06,2020-09-28,False
201811,2348,BMT Cordah Ltd,1398,EDMO,2019-11-13,2020-09-28,False
146028,2349,Data Archive for Seabed Species and Habitats (DASSH),1398,EDMO,2015-02-06,2020-09-28,True
146029,2350,National Museum Wales Department of Biodiversity & Systematic Biology (BioSyB),1398,EDMO,2015-02-06,2020-09-28,False
146030,2351,Devon Wildlife Trust,1398,EDMO,2015-02-06,2020-09-28,False
146031,2352,Dorset County Council Planning Department,1398,EDMO,2015-02-06,2020-09-28,False
146032,2354,Geotek Ltd,1398,EDMO,2015-02-06,2020-09-28,False
228998,2355,Helford Voluntary Marine Conservation Area,1398,EDMO,2020-07-29,2020-09-28,False
146033,2359,Marine Ecological Surveys Ltd,1398,EDMO,2015-02-06,2020-09-28,False
144884,236,University of Bologna, Environmental Science, Laboratory SINCEM, Ravenna,1398,EDMO,2015-02-06,2020-09-28,False
146034,2360,National Marine Aquarium (NMA),1398,EDMO,2015-02-06,2020-09-28,False
154782,2361,National Trust (NT),1398,EDMO,2015-07-22,2020-09-28,False
146035,2362,North Devon Museum,1398,EDMO,2015-02-06,2020-09-28,False
199957,2363,Plymouth City Museums and Art Gallery,1398,EDMO,2019-06-28,2020-09-28,False
146036,2364,Poole Harbour Commissioners (PHC),1398,EDMO,2015-02-06,2020-09-28,False
144885,237,Stazione Zoologica Anton Dohrn of Naples,1398,EDMO,2015-02-06,2020-09-28,False
146037,2370,University of Glasgow, Department of Geographical and Earth Sciences,1398,EDMO,2015-02-06,2020-09-28,False
146038,2372,University of Western Australia, School of Environmental Systems Engineering,1398,EDMO,2015-02-06,2020-09-28,True
146039,2373,Woods Hole Oceanographic Institution: Geology & Geophysics Department,1398,EDMO,2015-02-06,2020-09-28,False
146040,2374,University Institution Antwerp (UIA),1398,EDMO,2015-02-06,2020-09-28,True
146041,2375,University of Antwerp (Campus Drie Eiken) (UA),1398,EDMO,2015-02-06,2020-09-28,False
146042,2376,University of Ghent, Faculty of Medicine and Health Sciences, Heymans Institute of Pharmacology,1398,EDMO,2015-02-06,2020-12-05,False
146043,2377,Centre for Agricultural Research, Station for Fisheries (CLO-RVZ),1398,EDMO,2015-02-06,2020-12-05,True
146044,2378,University of Cardiff, School of Earth, Ocean and Planetary Science,1398,EDMO,2015-02-06,2020-09-28,True
146045,2379,University of Cardiff, Geology Department,1398,EDMO,2015-02-06,2020-09-28,True
144886,238,Marine Biology Laboratory of Trieste,1398,EDMO,2015-02-06,2020-09-28,True
146046,2380,Durham University, Department of Earth Sciences,1398,EDMO,2015-02-06,2020-09-28,False
146047,2381,National Parks and Wildlife Service (NPWS),1398,EDMO,2015-02-06,2020-09-28,False
146048,2382,University of Ulster, School of Environmental Sciences, Environmental Sciences Research Institute,1398,EDMO,2015-02-06,2020-09-28,False
146049,2383,Ministry of Science and Technology of China  (MOST),1398,EDMO,2015-02-06,2020-11-03,False
146050,2384,Gatty Marine Laboratory,1398,EDMO,2015-02-06,2020-09-28,False
146051,2385,University of Strathclyde, Department of Physics,1398,EDMO,2015-02-06,2020-09-28,False
146052,2386,British Geological Survey Marine Operations (BGS),1398,EDMO,2015-02-06,2020-09-28,False
146053,2387,Institute of Geological Sciences Marine Operations,1398,EDMO,2015-02-06,2020-09-28,True
146054,2388,University of Aberdeen, School of Biological Sciences,1398,EDMO,2015-02-06,2020-09-28,False
146055,2389,Planning Systems Inc, Reston,1398,EDMO,2015-02-06,2020-09-28,False
144887,239,CONISMA, National Interuniversity Consortium for Marine Science,1398,EDMO,2015-02-06,2020-09-28,False
146056,2390,University of Cologne, Institute of Geology and Mineralogy,1398,EDMO,2015-02-06,2020-09-28,False
146057,2391,European Space Agency  (ESA),1398,EDMO,2015-02-06,2020-11-03,False
146058,2392,University of Edinburgh, School of GeoSciences,1398,EDMO,2015-02-06,2020-09-28,False
146059,2393,University of Edinburgh, School of Earth, Environmental and Geographical Sciences,1398,EDMO,2015-02-06,2020-09-28,True
146060,2394,University of Edinburgh, Department of Geology,1398,EDMO,2015-02-06,2020-09-28,True
146061,2395,Sea Fish Industry Authority (SFIA),1398,EDMO,2015-02-06,2020-09-28,False
146062,2396,Woods Hole Oceanographic Institution: Applied Ocean Physics & Engineering Department,1398,EDMO,2015-02-06,2020-09-28,False
146063,2397,British Geological Survey, Keyworth (BGS),1398,EDMO,2015-02-06,2020-09-28,False
146064,2398,Institute of Geological Sciences, Keyworth,1398,EDMO,2015-02-06,2020-09-28,True
146065,2399,British Geological Survey, Grays Inn Road (BGS),1398,EDMO,2015-02-06,2020-09-28,True
144718,24,Defence Evaluation Research Agency (DERA),1398,EDMO,2015-02-06,2020-09-28,True
144888,240,Université Libre de Bruxelles, Laboratory of Chemical Oceanography and Water Geochemistry,1398,EDMO,2015-02-06,2020-09-28,False
146066,2400,Institute of Geological Sciences, Grays Inn Road,1398,EDMO,2015-02-06,2020-09-28,True
146067,2401,Xiamen University, State Key Laboratory of Marine Environmental Science,1398,EDMO,2015-02-06,2020-09-28,False
146068,2402,Max Planck Institute for Meteorology  (MPI-M),1398,EDMO,2015-02-06,2020-11-03,False
146069,2403,Defence Laboratories, Laboratory for Detection, Sampling and Sample Preparation (DLD-DSS),1398,EDMO,2015-02-06,2020-09-28,False
146070,2404,Royal Military Academy, CISS Dept., Signal and Image Centre (CISS-SIC),1398,EDMO,2015-02-06,2020-09-28,False
146071,2405,Edinburgh Napier University School of Life Sciences,1398,EDMO,2015-02-06,2020-09-28,False
146072,2406,Napier Technical College,1398,EDMO,2015-02-06,2020-09-28,True
146073,2407,Scottish Universities Environmental Research Centre (SUERC),1398,EDMO,2015-02-06,2020-09-28,False
146074,2408,Scottish Universities Research Reactor Centre,1398,EDMO,2015-02-06,2020-09-28,True
146075,2409,Fugro Survey Limited,1398,EDMO,2015-02-06,2020-09-28,False
146076,2410,Gardline Geosurvey Limited,1398,EDMO,2015-02-06,2020-09-28,True
146077,2411,Perenco UK Limited,1398,EDMO,2015-02-06,2020-09-28,False
146078,2412,Total Exploration and Production UK Limited,1398,EDMO,2015-02-06,2020-09-28,False
146079,2413,TUBITAK, Marmara Research Center, Environment Institute (Marine and Inland Waters Management SBU),1398,EDMO,2015-02-06,2020-12-05,False
146080,2414,University of Plymouth School of Earth, Ocean and Environmental Sciences,1398,EDMO,2015-02-06,2020-09-28,True
146081,2415,Polytechnic South West Institute of Marine Studies,1398,EDMO,2015-02-06,2020-09-28,True
146082,2416,Plymouth Polytechnic Institute of Marine Studies,1398,EDMO,2015-02-06,2020-09-28,True
147537,2417,Royal Commission on the Ancient and Historical Monuments of Scotland (RCAHMS),1398,EDMO,2015-02-06,2020-09-28,True
147538,2418,Institute of Technology Tralee (ITT),1398,EDMO,2015-02-06,2020-09-28,False
147539,2419,Schlumberger Information Solutions  (SIS),1398,EDMO,2015-02-06,2020-11-03,False
144889,242,Katholieke Universiteit Leuven, University Center for Statistics, University Center for Statistics,1398,EDMO,2015-02-06,2020-09-28,False
147540,2420,Common Data Access Limited (CDAL),1398,EDMO,2015-02-06,2020-09-28,False
147541,2421,GBIF secretariat,1398,EDMO,2015-02-06,2020-09-28,False
147542,2422,Wageningen Marine Research, Den Helder (WMR),1398,EDMO,2015-02-06,2020-09-28,False
147543,2423,Wageningen Marine Research, Yerseke (WMR),1398,EDMO,2015-02-06,2020-09-28,False
147544,2424,National Oceanography Centre, Liverpool (NOC),1398,EDMO,2015-02-06,2020-09-28,False
147545,2425,Laboratory for the Faroese Food- veterinary and environmental agency,1398,EDMO,2015-02-06,2020-09-28,False
147546,2426,Individual Enterprise Ecocentre "YAN" Tebigata Yardam Merkezi,1398,EDMO,2015-02-06,2020-09-28,False
147547,2427,Emerol Limited,1398,EDMO,2015-02-06,2020-09-28,False
147548,2428,State Enterprise on Caspian Issues under the President of Turkmenistan,1398,EDMO,2015-02-06,2020-09-28,False
147549,2429,The Caspian ecological service “CaspEcoControl”,1398,EDMO,2015-02-06,2020-09-28,False
144890,243,Katholieke Universiteit Leuven, Department of Civil Engineering, Hydraulics Laboratory,1398,EDMO,2015-02-06,2020-09-28,False
147550,2430,Finnmark University College,1398,EDMO,2015-02-06,2020-09-28,False
147551,2431,OGS (Istituto Nazionale di Oceanografia e di Geofisica Sperimentale), Department of Biological Oceanography,1398,EDMO,2015-02-06,2020-09-28,True
147552,2432,Institute of Marine Biology (IMBK) (IMBK - IBMK),1398,EDMO,2015-02-06,2020-10-27,False
147553,2434,University of Geneva , Institute of Environmental Sciences (UNIGE),1398,EDMO,2015-02-06,2020-11-03,False
147554,2435,WWF, Turkey,1398,EDMO,2015-02-06,2020-12-05,False
147555,2436,Marine Monitoring AB,1398,EDMO,2015-02-06,2020-09-28,False
147556,2437,Institute of Zoology of the Azerbaijan, National Academy of  Sciences,1398,EDMO,2015-02-06,2020-12-05,False
147557,2438,Institute of Geology of the Azerbaijan, National Academy of  Sciences,1398,EDMO,2015-02-06,2020-12-05,False
144891,244,University of Liège, Astrophysics Institute, Laboratory for Planetary and Atmospheric Physics (LPAP),1398,EDMO,2015-02-06,2020-12-05,False
147558,2441,Department of Monitoring of an Environment of Caspian sea, Ministry of Ecology and Nature Resource,1398,EDMO,2015-02-06,2020-12-05,False
147559,2442,Baku State University,1398,EDMO,2015-02-06,2020-09-28,False
147560,2443,Institute of Ecology, Azerbaijan National Space Agency,1398,EDMO,2015-02-06,2020-12-05,False
147561,2444,Department of Agriculture for Northern Ireland (DANI),1398,EDMO,2015-02-06,2020-09-28,True
147562,2445,Sandia National Laboratories, New Mexico,1398,EDMO,2015-02-06,2020-09-28,False
147563,2446,National University Of Mexico, Intituto De Geofisica (Unam),1398,EDMO,2015-02-06,2020-12-05,False
147564,2447,Brown University, Dept of Geological Sciences,1398,EDMO,2015-02-06,2020-12-05,False
147565,2448,Boise State University, Department of Geosciences,1398,EDMO,2015-02-06,2020-12-05,False
147566,2449,University of Bremen, Institute of Environmental Physics (IUP),1398,EDMO,2015-02-06,2020-09-28,False
144892,245,University of Liège, Faculty of Veterinary Medicine, Department of Pathology,1398,EDMO,2015-02-06,2020-12-05,False
147567,2450,State University of New York College of Environmental Science and Forestry,1398,EDMO,2015-02-06,2020-09-28,False
147568,2451,University of California Irvine Department of Earth System Science,1398,EDMO,2015-02-06,2020-09-28,False
147569,2452,Institute of Atmospheric Physics, Chinese Academy of Sciences,1398,EDMO,2015-02-06,2020-09-28,False
147570,2453,UPO, Pablo de Olavide University (UPO),1398,EDMO,2015-02-06,2020-12-15,False
147571,2454,IMOS eMarine Information Infrastructure (eMII), University of Tasmania (eMII
),1398,EDMO,2015-02-06,2020-09-28,True
147572,2455,Pontifical Catholic University of Rio de Janeiro, Department of Chemistry,1398,EDMO,2015-02-06,2020-09-28,False
147573,2456,Physical Research Laboratory, Ahmedabad,1398,EDMO,2015-02-06,2020-09-28,False
147574,2457,University of Birmingham School of Geography, Earth and Environmental Sciences,1398,EDMO,2015-02-06,2020-09-28,False
147575,2458,University of Birmingham School of Earth Sciences,1398,EDMO,2015-02-06,2020-09-28,True
147576,2459,University of Birmingham Department of Geology with Geophysics,1398,EDMO,2015-02-06,2020-09-28,True
144893,246,University of Liège, Département de Géomatique, Laboratoire SURFACES,1398,EDMO,2015-02-06,2020-12-05,False
147577,2460,University of Birmingham Department of Geology,1398,EDMO,2015-02-06,2020-09-28,True
147578,2461,NUI AS (Norwegian Underwater Intervention),1398,EDMO,2015-02-06,2020-09-28,False
147579,2462,IUCN Centre for Mediterranean Cooperation,1398,EDMO,2015-02-06,2020-09-28,False
147580,2463,IUCN Headquarters, International Union for Conservation of Nature,1398,EDMO,2015-02-06,2020-12-05,False
147581,2466,Plan Bleu pour l'Environnement et le Développement  en Méditerrannee,1398,EDMO,2015-02-06,2020-09-28,False
147582,2467,ACRI Etudes et Conseil,1398,EDMO,2015-02-06,2020-09-28,False
147583,2468,National Institute of Oceanography and Fisheries,1398,EDMO,2015-02-06,2020-09-28,False
144894,247,University of Liège, Ecohydrodynamic Unit,1398,EDMO,2015-02-06,2020-12-05,False
147584,2470,Fondation Tour du Valat,1398,EDMO,2015-02-06,2020-09-28,False
147585,2471,National Authority for Remote Sensing and Space Sciences,1398,EDMO,2015-02-06,2020-09-28,False
147586,2472,Mediterranean Coastal Foundation,1398,EDMO,2015-02-06,2020-09-28,False
147587,2474,Geographical Society of Azerbaijan,1398,EDMO,2015-02-06,2020-09-28,False
147588,2475,University of Duisburg-Essen, Applied Zoology/Hydrobiology,1398,EDMO,2015-02-06,2020-09-28,False
147589,2476,TNO (TNO),1398,EDMO,2015-02-06,2020-09-28,False
147590,2477,Executive Agency for Higher-Education and Research Funding (UEFISCDI),1398,EDMO,2015-02-06,2020-09-28,False
147591,2478,National Authority for Scientific Research (ANCS),1398,EDMO,2015-02-06,2020-09-28,False
147592,2479,Northern Caspian Directorate for Enforcement Technical Support at Sea (Federal State Institution),1398,EDMO,2015-02-06,2020-09-28,False
144895,248,University of Mons-Hainaut, Laboratory of Marine Biology,1398,EDMO,2015-02-06,2020-09-28,False
147593,2480,Dagestan Centre for Hydrometeorology and Environment Monitoring,1398,EDMO,2015-02-06,2020-09-28,False
147594,2481,Institute of Physiology of the Azerbaijan National Academy of  Sciences,1398,EDMO,2015-02-06,2020-09-28,False
147595,2482,Institute of Microbiology of the Azerbaijan National Academy of  Sciences,1398,EDMO,2015-02-06,2020-09-28,False
147596,2483,IQLIM LTD, Research and Consulting Company,1398,EDMO,2015-02-06,2020-09-28,False
147597,2484,Aquatic Research Centre of the Swiss Federal Institute of Environmental Science and Technology (EAWAG/ETH),1398,EDMO,2015-02-06,2020-11-03,False
147598,2485,North Atlantic Fisheries College Marine Centre (NAFC),1398,EDMO,2015-02-06,2020-09-28,False
147599,2486,Research Institute of the Caspian Sea problems Ltd,1398,EDMO,2015-02-06,2020-09-28,False
147600,2487,Astrakhan State Nature Biosphere Reserve,1398,EDMO,2015-02-06,2020-09-28,False
147601,2488,Caspian Regional Center, Environment and Law, Ltd,1398,EDMO,2015-02-06,2020-12-05,False
147602,2489,CSIC-UTM, Marine Technology Unit (CSIC-UTM),1398,EDMO,2015-02-06,2021-04-30,False
144896,249,Department of Fisheries and Marine Research, Division of Marine Biology and Ecology (DFMR),1398,EDMO,2015-02-06,2020-09-28,False
147603,2490,KazHYDROMET,1398,EDMO,2015-02-06,2020-09-28,False
147604,2491,Newcastle University School of Marine Science and Technology,1398,EDMO,2015-02-06,2020-09-28,False
147605,2492,Newcastle University Department of Marine Science and Coastal Management,1398,EDMO,2015-02-06,2020-09-28,True
147606,2493,Shetland Islands Council,1398,EDMO,2015-02-06,2020-09-28,False
147607,2496,University of Manchester School of Earth, Atmospheric and Environmental Sciences,1398,EDMO,2015-02-06,2020-09-28,False
147608,2497,Dorset Wildlife Trust,1398,EDMO,2015-02-06,2020-09-28,False
147609,2498,Edge Hill University, Department of Natural, Geographical and Applied Sciences,1398,EDMO,2015-02-06,2020-09-28,False
147610,2499,University of Oxford, Department of Earth Sciences,1398,EDMO,2015-02-06,2020-09-28,False
144719,25,Hadley Centre for Climate Prediction and Research (HCCPR),1398,EDMO,2015-02-06,2020-09-28,False
144897,250,Ghent University, Center for Medical and Urological Andrology,1398,EDMO,2015-02-06,2020-12-05,False
147611,2500,University of Tasmania, Institute of Antarctic and Southern Ocean Studies  (IASOS),1398,EDMO,2015-02-06,2020-11-03,True
147612,2501,University of Tasmania, Centre for Marine Science,1398,EDMO,2015-02-06,2020-09-28,True
147613,2502,Royal Holloway, University of London, Department of Earth Sciences,1398,EDMO,2015-02-06,2020-09-28,False
147614,2503,Regional Operational Sub-Centre for Monitoring and Rescue in Mediterranean sea, CORSICA (CROSS-MED),1398,EDMO,2015-02-06,2020-12-05,False
147615,2504,Regional Operational Centre for Monitoring and Rescue (CROSS), CORSEN,1398,EDMO,2015-02-06,2020-12-05,False
147616,2505,Regional Operational Centre for Monitoring and Rescue (CROSS RU), COSRU,1398,EDMO,2015-02-06,2020-12-05,False
147617,2506,Regional Operational Centre for Monitoring and Rescue (CROSS), Antilles Guyane,1398,EDMO,2015-02-06,2020-12-05,False
147618,2507,Directorate-General of Customs and Indirect Taxes,1398,EDMO,2015-02-06,2020-09-28,False
147619,2508,Regional Operational Centre for Monitoring and Rescue (CROSS), Etel,1398,EDMO,2015-02-06,2020-12-05,False
147620,2509,Regional Operational Centre for Monitoring and Rescue (CROSS), Gris-nez,1398,EDMO,2015-02-06,2020-12-05,False
144898,251,Istituto Nazionale di Geofisica e Vulcanologia, Sede di Bologna (INGV),1398,EDMO,2015-02-06,2020-12-05,False
147621,2510,Regional Operational Centre for Monitoring and Rescue (CROSS), Jobourg,1398,EDMO,2015-02-06,2020-12-05,False
147622,2511,Regional Operational Centre for Monitoring and Rescue in Mediterranean sea (CROSS-MED), La Garde,1398,EDMO,2015-02-06,2020-12-05,False
147623,2512,The French Navy,1398,EDMO,2015-02-06,2020-09-28,False
147624,2513,University of Patras, Department of Geology, Laboratory of Marine Geology and Physical Oceanography  (ETHAGEPHO/UP),1398,EDMO,2015-02-06,2020-11-03,False
147625,2514,University of Amsterdam, Institute for Biodiversity and Ecosystem Dynamics (Main Office) (IBED),1398,EDMO,2015-02-06,2020-09-28,False
147626,2515,University of Amsterdam, Department of Physical Geography and Soil Science,1398,EDMO,2015-02-06,2020-09-28,True
147627,2516,University of Algarve, Marine Sciences Centre (CCMAR),1398,EDMO,2015-02-06,2020-09-28,False
147628,2517,James Cook University, School of Mathematical and Physical Sciences,1398,EDMO,2015-02-06,2020-09-28,True
147629,2518,James Cook University, Department of Physics,1398,EDMO,2015-02-06,2020-09-28,True
