tblCodeID,Code,Description,tblCodeTypeID,CodeType,Created,Modified,Deprecated
146466,3451,Marine Planning Consultants (MPC),1398,EDMO,2015-02-06,2020-09-28,False
146467,3452,Land Use Consultants, London (LUC),1398,EDMO,2015-02-06,2020-09-28,False
146468,3453,University Bayreuth (UBT),1398,EDMO,2015-02-06,2020-09-28,False
146469,3454,University Würzburg (JMU),1398,EDMO,2015-02-06,2020-09-28,False
146470,3455,University Münster (WWU),1398,EDMO,2015-02-06,2020-09-28,False
146471,3456,Hanse-Wissenschaftskolleg (HWK),1398,EDMO,2015-02-06,2020-09-28,False
146472,3457,Institute for Geoinformatics and Remote Sensing, University of Osnabrueck (IGF),1398,EDMO,2015-02-06,2020-09-28,False
146473,3458,Institute of Photogrammetry and GeoInformation (IPI) of Leibniz Universität Hannover (IPI),1398,EDMO,2015-02-06,2020-09-28,False
146474,3459,Nationalparkverwaltung Niedersächsisches Wattenmeer (NLPV),1398,EDMO,2015-02-06,2020-10-07,False
144992,346,Shannon Foynes Port Company (SFPC),1398,EDMO,2015-02-06,2020-09-28,False
146475,3460,Marine Invertebrate Ecological Services (MIES),1398,EDMO,2015-02-06,2020-09-28,False
146476,3461,Benthic Solutions Limited,1398,EDMO,2015-02-06,2020-09-28,False
146477,3462,Plymouth University Marine Institute,1398,EDMO,2015-02-06,2020-09-28,False
146478,3463,Centrica Energy,1398,EDMO,2015-02-06,2020-09-28,False
146479,3464,County Administration Board of Norrbottens lan,1398,EDMO,2015-02-06,2020-09-28,False
146480,3465,County Administration Board of Vasternorrlands lan,1398,EDMO,2015-02-06,2020-09-28,False
146481,3466,County Administration Board of Gavleborgs lan,1398,EDMO,2015-02-06,2020-09-28,False
146482,3467,County Administration Board of Ostergotlands lan,1398,EDMO,2015-02-06,2020-09-28,False
146483,3468,County Administration Board of Stockholm lan,1398,EDMO,2015-02-06,2020-09-28,False
146484,3469,County Administration Board of Dalarnas lan,1398,EDMO,2015-02-06,2020-09-28,False
144993,347,Louth County Council,1398,EDMO,2015-02-06,2020-09-28,False
146485,3470,County Administration Board of Uppsala lan,1398,EDMO,2015-02-06,2020-09-28,False
146486,3471,Baltic Sea Hydrographic Commission (BSHC),1398,EDMO,2015-02-06,2020-09-28,False
146487,3472,NOAA National Climatic Data Center (NCDC),1398,EDMO,2015-02-06,2020-09-28,False
146488,3473,Hamburg Ship Model Basin (HSVA),1398,EDMO,2015-02-06,2020-09-28,False
146489,3474,O.A.Sys (O:A:Sys),1398,EDMO,2015-02-06,2020-09-28,False
146490,3475,FastOpt (FastOpt),1398,EDMO,2015-02-06,2020-09-28,False
146491,3476,Ecuadorian Navy Oceanographic Institute (INOCAR),1398,EDMO,2015-02-06,2020-09-28,False
146492,3477,National Scientific and Technical Research Council (CONICET),1398,EDMO,2015-02-06,2020-09-28,False
146493,3478,Berwickshire and North Northumberland Coast European Marine Site Management Group (Berwickshire and North Northumberland Coast EMS),1398,EDMO,2015-02-06,2020-09-28,False
146494,3479,Statkraft UK Ltd,1398,EDMO,2015-02-06,2020-09-28,False
146495,3480,Royal Australian Navy Weapons Systems Research Laboratory Marine Systems Division (WSRL-MSD),1398,EDMO,2015-02-06,2020-09-28,True
146496,3481,Royal Australian Navy Weapons Systems Research Laboratory Marine Systems Division (WSRL-MSD),1398,EDMO,2015-02-06,2020-09-28,True
146497,3482,Royal Australian Navy Research Laboratory (RANRL),1398,EDMO,2015-02-06,2020-09-28,True
146498,3483,Royal Australian Navy Experimental Laboratory (RANEL),1398,EDMO,2015-02-06,2020-09-28,True
146499,3484,Heinrich-Heine-University Düsseldorf (HHU),1398,EDMO,2015-02-06,2020-09-28,False
146500,3485,Waterways and Shipping Office Bremen (WSA-Bremen),1398,EDMO,2015-02-06,2020-09-28,False
146501,3486,Institute for Geology, Hamburg,1398,EDMO,2015-02-06,2020-09-28,False
146502,3487,University IUAV of Venice (IUAV),1398,EDMO,2015-02-06,2020-09-28,False
146503,3488,University of Liverpool Department of Earth, Ocean and Ecological Sciences,1398,EDMO,2015-02-06,2020-09-28,False
146504,3489,Noble Energy Mediterranean LTD,1398,EDMO,2015-02-06,2020-09-28,False
144994,349,Wood Group Kenny Ireland Ltd (WGK Irl Ltd),1398,EDMO,2015-02-06,2020-09-28,False
146505,3490,Aquatonics UK Ltd,1398,EDMO,2015-02-06,2020-09-28,False
146506,3492,National Centre for the Development of the Oceans, Brittany Oceanological Centre (CNEXO),1398,EDMO,2015-02-06,2020-09-28,True
146507,3493,ADUS DeepOcean Ltd,1398,EDMO,2015-02-06,2020-09-28,False
146508,3494,Micro-g LaCoste,1398,EDMO,2015-02-06,2020-09-28,False
146509,3495,Applanix,1398,EDMO,2015-02-06,2015-02-06,False
146510,3496,Geonica,1398,EDMO,2015-02-06,2020-09-28,False
146511,3497,PLOCAN, Oceanic Platform of the Canary Islands (PLOCAN),1398,EDMO,2015-02-06,2020-12-15,False
146512,3498,ENECO, Prinses Amaliawindpark,1398,EDMO,2015-02-06,2020-12-05,False
146513,3499,Bayworld Centre For Research & Education, Bayworld Centre For Research And Education (BCRE),1398,EDMO,2015-02-06,2020-12-05,False
144729,35,North East River Purification Board (NERPB),1398,EDMO,2015-02-06,2020-09-28,False
144995,350,UM, Murcia University. Ecology Department (UM),1398,EDMO,2015-02-06,2020-12-15,False
146514,3500,IRD Legos,1398,EDMO,2015-02-06,2020-09-28,False
146515,3501,University of Sciences and Technology Houari Boumedienne,1398,EDMO,2015-02-06,2020-09-28,False
146516,3502,COASTLINE, ENVIRONMENT, REMOTE SENSING, GEOMATICS, UMR 6554, BREST (LETG),1398,EDMO,2015-02-06,2020-12-05,False
146517,3503,University of Caen, CREAAH Service Régional Archeologie Basse-Normandie,1398,EDMO,2015-02-06,2020-12-05,False
146518,3504,University of Corsica Pasquale Paoli,1398,EDMO,2015-02-06,2020-09-28,False
148332,3506,Chalmers University of Technology (CHALMERS),1398,EDMO,2015-03-16,2020-09-28,False
146519,3507,Institute for Environmental Solutions (VRI),1398,EDMO,2015-02-06,2020-09-28,False
146520,3508,Latvian Fund for Nature (LDF),1398,EDMO,2015-02-06,2020-09-28,False
146521,3509,Nature Conservation Agency (DAP),1398,EDMO,2015-02-06,2020-09-28,False
144996,351,UNIOVI, University of Oviedo, Biology of Organisms and Systems departament (UNIOVI),1398,EDMO,2015-02-06,2020-12-15,False
146522,3510,MeteoGalicia (MeteoGalicia),1398,EDMO,2015-02-06,2020-09-28,False
146523,3511,EUSKALMET, Basque Metereological Agency (EUSKALMET),1398,EDMO,2015-02-06,2020-12-15,False
146524,3512,The Swedish Agency for Marine and Water Management (SWAM),1398,EDMO,2015-02-06,2021-06-25,False
146525,3513,AECOM/ENSR (ENSR),1398,EDMO,2015-02-06,2020-09-28,False
146526,3514,Alion Science and Technology (Alion),1398,EDMO,2015-02-06,2020-09-28,False
146527,3515,AMPAC, Inc. (AMPAC),1398,EDMO,2015-02-06,2020-09-28,False
146528,3516,Appalachian State University (App State),1398,EDMO,2015-02-06,2020-09-28,False
146529,3517,Arizona State University (ASU),1398,EDMO,2015-02-06,2020-09-28,False
146530,3518,ARMADA Project (ARMADA),1398,EDMO,2015-02-06,2020-09-28,False
146531,3519,Ashtech,1398,EDMO,2015-02-06,2020-09-28,False
144997,352,UV, Valencia University. Plant Biology Department  (UV),1398,EDMO,2015-02-06,2020-12-15,False
146532,3520,Auburn University (Auburn),1398,EDMO,2015-02-06,2020-09-28,False
147227,3521,Barnard College (Barnard),1398,EDMO,2015-02-06,2020-09-28,False
147228,3522,Bell Aerospace TEXTRON (Bell),1398,EDMO,2015-02-06,2020-09-28,False
147229,3523,Binghamton University (Binghamton),1398,EDMO,2015-02-06,2020-09-28,False
147230,3524,Biospherical Instruments, Inc. (Biospherical),1398,EDMO,2015-02-06,2020-09-28,False
147231,3525,BMT Scientific Marine Services, Inc. (BMT),1398,EDMO,2015-02-06,2020-09-28,False
147232,3526,C&C Technologies, Inc. (C&C),1398,EDMO,2015-02-06,2020-09-28,False
147233,3527,Center for Coastal and Ocean Mapping (CCOM),1398,EDMO,2015-02-06,2020-09-28,False
147234,3528,Coastal Carolina University (CCU),1398,EDMO,2015-02-06,2020-09-28,False
147235,3529,Coastal Environmental Systems, Inc. (Coastal),1398,EDMO,2015-02-06,2020-09-28,False
144998,353,IEO, Spanish Oceanographic Institute (IEO),1398,EDMO,2015-02-06,2020-12-15,False
147236,3530,Colgate University,1398,EDMO,2015-02-06,2020-09-28,False
147237,3531,College of Charleston (Charleston),1398,EDMO,2015-02-06,2020-09-28,False
147238,3532,Colorado School of Mines (Mines),1398,EDMO,2015-02-06,2020-09-28,False
147239,3533,Columbia University (Columbia),1398,EDMO,2015-02-06,2020-09-28,False
147240,3534,Continental Shelf Associates, Inc. (CSA),1398,EDMO,2015-02-06,2020-09-28,False
147241,3535,Daniel H. Wagner Associates, Inc. (Wagner),1398,EDMO,2015-02-06,2020-09-28,False
147242,3536,Department of State (USDOS),1398,EDMO,2015-02-06,2020-09-28,False
147243,3537,East Carolina University (ECU),1398,EDMO,2015-02-06,2020-09-28,False
147244,3538,Edison Chouest Offshore (Chouest),1398,EDMO,2015-02-06,2020-09-28,False
147245,3539,Eppley Laboratory, Inc. (Eppley),1398,EDMO,2015-02-06,2020-09-28,False
144999,354,PdE, Harbours Authority. Physical Environment Department (PdE),1398,EDMO,2015-02-06,2020-12-15,False
147246,3540,Evergreen State College (Evergeen),1398,EDMO,2015-02-06,2020-09-28,False
147247,3541,E W Wells Group, Inc. (Wells),1398,EDMO,2015-02-06,2020-09-28,False
147248,3542,Field Museum,1398,EDMO,2015-02-06,2020-09-28,False
147249,3543,Florida Atlantic University (FAU),1398,EDMO,2015-02-06,2020-09-28,False
147250,3544,Florida Fish & Wildlife Conservation Commission (FFWCC),1398,EDMO,2015-02-06,2020-09-28,False
147251,3545,Florida Institute of Technology (FIT),1398,EDMO,2015-02-06,2020-09-28,False
147252,3546,Furuno,1398,EDMO,2015-02-06,2020-09-28,False
147253,3547,General Dynamics Information Technology (Anteon),1398,EDMO,2015-02-06,2020-09-28,False
147254,3548,General Oceanics, Inc. (General Oceanics),1398,EDMO,2015-02-06,2020-09-28,False
147255,3549,Geometrics (Duplicate),1398,EDMO,2015-02-06,2020-09-28,True
145000,355,USC, Santiago de Compostela Un iversity. Department of Analytical Chemistry (USC),1398,EDMO,2015-02-06,2020-12-15,False
147256,3550,Gordon & Betty Moore Foundation (Moore),1398,EDMO,2015-02-06,2020-09-28,False
147257,3551,Gray's Reef National Marine Sanctuary (GRNMS),1398,EDMO,2015-02-06,2020-09-28,False
147258,3552,Harbor Branch Oceanographic Institute (HBOI),1398,EDMO,2015-02-06,2020-09-28,False
147259,3553,Haverford College (Haverford),1398,EDMO,2015-02-06,2020-09-28,False
147260,3554,Hood Canal Salmon Enhancement Group (HCSEG),1398,EDMO,2015-02-06,2020-09-28,False
147261,3555,Incorporated Research Institutions for Seismology (IRIS),1398,EDMO,2015-02-06,2020-09-28,False
147262,3556,Indiana University of Pennsylvania (IUP),1398,EDMO,2015-02-06,2020-09-28,False
147263,3557,Institute for Exploration (IFE),1398,EDMO,2015-02-06,2020-09-28,False
147264,3558,Instrument & Technical Systems, Inc. (ITS),1398,EDMO,2015-02-06,2020-09-28,False
147265,3559,INTECSEA (INTEC),1398,EDMO,2015-02-06,2020-09-28,False
145001,356,USC, Santiago de Compostela University . Department of Animal Biology (USC),1398,EDMO,2015-02-06,2020-12-15,False
147266,3560,Integrated Earth Data Applications (IEDA),1398,EDMO,2015-02-06,2020-09-28,False
147267,3561,iXSea, Inc. (iXSea),1398,EDMO,2015-02-06,2020-09-28,False
147268,3562,JMS Naval Architects & Salvage Engineers (JMS),1398,EDMO,2015-02-06,2020-09-28,False
147269,3563,Kansas State University (KSU),1398,EDMO,2015-02-06,2020-09-28,False
147270,3564,Kent State,1398,EDMO,2015-02-06,2020-09-28,False
147271,3565,Lehigh University (Lehigh),1398,EDMO,2015-02-06,2020-09-28,False
147272,3566,LMCO/ORINCON (ORINCON),1398,EDMO,2015-02-06,2020-09-28,False
147273,3567,Lockheed Martin, Inc. (LMCO),1398,EDMO,2015-02-06,2020-09-28,False
147274,3568,Louisiana Department of Wildlife and Fisheries (LaWLF),1398,EDMO,2015-02-06,2020-09-28,False
147275,3569,Marine Biological Laboratory (MBL),1398,EDMO,2015-02-06,2020-09-28,False
145002,357,USC, Santiago de Compostela University (LUGO). Department of Animal Biology  (USC),1398,EDMO,2015-02-06,2020-12-15,False
147276,3570,Markey Machinery (Markey),1398,EDMO,2015-02-06,2020-09-28,False
147277,3571,MATE Program (MATE),1398,EDMO,2015-02-06,2020-09-28,False
147278,3572,Michigan State University (MSU),1398,EDMO,2015-02-06,2020-09-28,False
147279,3573,Middlebury College (Middlebury),1398,EDMO,2015-02-06,2020-09-28,False
147280,3574,Minnesota Department of Natural Resources (MNDNR),1398,EDMO,2015-02-06,2020-09-28,False
147281,3575,MX Marine, Inc. (MX Marine),1398,EDMO,2015-02-06,2020-09-28,False
147282,3576,National Ice Center (NIC),1398,EDMO,2015-02-06,2020-09-28,False
147283,3577,Naval Oceanographic Office (NAVO),1398,EDMO,2015-02-06,2020-09-28,False
147284,3578,Naval Research Laboratory (NRL),1398,EDMO,2015-02-06,2020-09-28,False
147285,3579,Naval Surface Warfare Center (NSWC),1398,EDMO,2015-02-06,2020-09-28,False
145003,358,US, Seville University, Department of Physiology and Zoology (US),1398,EDMO,2015-02-06,2020-12-15,False
147286,3580,NCS SubSea, Inc. (NCS SubSea),1398,EDMO,2015-02-06,2020-09-28,False
147287,3581,New England BioLabs (NEB),1398,EDMO,2015-02-06,2020-09-28,False
147288,3582,New Mexico Institute of Mining and Technology (NMT),1398,EDMO,2015-02-06,2020-09-28,False
147289,3583,NOAA Center for Satellite Applications and Research (STAR),1398,EDMO,2015-02-06,2020-09-28,False
147290,3584,NOAA Coastal Services Center (CSC),1398,EDMO,2015-02-06,2020-09-28,False
147291,3585,NOAA Dive Center (NDC),1398,EDMO,2015-02-06,2020-09-28,False
147292,3586,NOAA Great Lakes Environmental Research Laboratory (GLERL),1398,EDMO,2015-02-06,2020-09-28,False
147293,3587,NOAA Northeast Fisheries Science Center (NEFSC),1398,EDMO,2015-02-06,2020-09-28,False
147294,3588,NOAA Northwest Fisheries Science Center (NWFSC),1398,EDMO,2015-02-06,2020-09-28,False
147295,3589,NOAA Office of Ocean Exploration and Research (OER),1398,EDMO,2015-02-06,2020-09-28,False
145004,359,UV, Valencia University, Department of Zoology  (UV),1398,EDMO,2015-02-06,2020-12-15,False
147296,3590,Noise Control Engineering (NCE),1398,EDMO,2015-02-06,2020-09-28,False
147297,3591,North Carolina State University (NCSU),1398,EDMO,2015-02-06,2020-09-28,False
147298,3592,Northeastern University (NEU),1398,EDMO,2015-02-06,2020-09-28,False
147299,3593,Northrop Grumman Aerospace Systems (Northrop Grumman),1398,EDMO,2015-02-06,2020-09-28,False
147300,3594,North Seattle Community College (NSCC),1398,EDMO,2015-02-06,2020-09-28,False
147301,3595,Northwestern University (NWU),1398,EDMO,2015-02-06,2020-09-28,False
147302,3596,Northwest Indian Fisheries Commission (NWIFC),1398,EDMO,2015-02-06,2020-09-28,False
147303,3597,Nova Southeastern University (Nova),1398,EDMO,2015-02-06,2020-09-28,False
147304,3598,Oak Ridge National Laboratory (ORNL),1398,EDMO,2015-02-06,2020-09-28,False
147305,3599,Ocean Data Technologies, Inc. (ODT),1398,EDMO,2015-02-06,2020-09-28,False
144730,36,PLA Hydrographic Service,1398,EDMO,2015-02-06,2020-09-28,False
145005,360,UVIGO, Vigo University, Department of Natural Resources and Environment  (UVIGO),1398,EDMO,2015-02-06,2020-12-15,False
147306,3600,Oceaneering International, Inc. (Oceaneering),1398,EDMO,2015-02-06,2020-09-28,False
147307,3601,Ocean Technology Foundation (OTF),1398,EDMO,2015-02-06,2020-09-28,False
147308,3602,Ohio State University (Ohio State),1398,EDMO,2015-02-06,2020-09-28,False
147309,3603,Optical Scientific, Inc. (OSI),1398,EDMO,2015-02-06,2020-09-28,False
147310,3604,Oregon Health & Science University (OHSU),1398,EDMO,2015-02-06,2020-09-28,False
147311,3605,Pennsylvania State University (Penn State),1398,EDMO,2015-02-06,2020-09-28,False
147312,3606,Prince William Sound Science Center (PWSSC),1398,EDMO,2015-02-06,2020-09-28,False
147313,3607,Queens College (Queens),1398,EDMO,2015-02-06,2020-09-28,False
147314,3608,Raytheon Company (Raytheon),1398,EDMO,2015-02-06,2020-09-28,False
147315,3609,Remote Research & Measurement Co. (RMR Co.),1398,EDMO,2015-02-06,2020-09-28,False
145006,361,UNIZAR, Zaragoza University. Department of Animal Production and Sciences of the Food. (UNIZAR),1398,EDMO,2015-02-06,2020-12-15,False
147316,3610,Rice University (Rice),1398,EDMO,2015-02-06,2020-09-28,False
147317,3611,R.M. Young Company (RM Young),1398,EDMO,2015-02-06,2020-09-28,False
147318,3612,Rockwell Collins, Inc. (Rockwell Collins),1398,EDMO,2015-02-06,2020-09-28,False
147319,3613,Rolling Deck to Repository (R2R),1398,EDMO,2015-02-06,2020-09-28,False
147320,3614,San Diego State University (SDSU),1398,EDMO,2015-02-06,2020-09-28,False
147321,3615,San Jose State University (SJSU),1398,EDMO,2015-02-06,2020-09-28,False
147322,3616,Santa Clara University (SCU),1398,EDMO,2015-02-06,2020-09-28,False
147323,3617,Science Applications International Corporation (SAIC),1398,EDMO,2015-02-06,2020-09-28,False
147324,3618,Sea-Bird Electronics, Inc. (Sea-Bird),1398,EDMO,2015-02-06,2020-09-28,False
147325,3619,Seafloor Systems, Inc. (Seafloor),1398,EDMO,2015-02-06,2020-09-28,False
147326,3620,Sea Launch,1398,EDMO,2015-02-06,2020-09-28,False
147327,3621,Seapoint Sensors, Inc (Seapoint),1398,EDMO,2015-02-06,2020-09-28,False
147328,3622,Seattle University (Seattle),1398,EDMO,2015-02-06,2020-09-28,False
147329,3623,Seaward Services, Inc. (Seaward),1398,EDMO,2015-02-06,2020-09-28,False
147330,3624,Sippican, Inc. (Sippican),1398,EDMO,2015-02-06,2020-09-28,False
147331,3625,Southern Illinois University (SIU),1398,EDMO,2015-02-06,2020-09-28,False
147332,3626,Sperry Marine (Sperry),1398,EDMO,2015-02-06,2020-09-28,False
147333,3627,Starlink, Inc. (Starlink),1398,EDMO,2015-02-06,2020-09-28,False
147334,3628,Subsea Systems, Inc. (Subsea),1398,EDMO,2015-02-06,2020-09-28,False
147335,3629,Susquehanna University (Susquehanna),1398,EDMO,2015-02-06,2020-09-28,False
147336,3630,Teledyne Benthos (Benthos),1398,EDMO,2015-02-06,2020-09-28,False
147337,3631,Teledyne RD Instruments (RDI),1398,EDMO,2015-02-06,2020-09-28,False
147338,3632,Teledyne TSS Ltd. (TSS),1398,EDMO,2015-02-06,2020-09-28,False
147339,3633,The College of William & Mary (William & Mary),1398,EDMO,2015-02-06,2020-09-28,False
147340,3634,Trimble Navigation Limited (Trimble),1398,EDMO,2015-02-06,2020-09-28,False
147341,3635,Turner Designs, Inc. (Turner),1398,EDMO,2015-02-06,2020-09-28,False
147342,3636,Ultra Electronics Ocean Systems (Ultra OS),1398,EDMO,2015-02-06,2020-09-28,False
147343,3637,Umpqua Community College (Umpqua),1398,EDMO,2015-02-06,2020-09-28,False
147344,3638,United States Antarctic Program (USAP),1398,EDMO,2015-02-06,2020-09-28,False
147345,3639,United States Coast Guard (USCG),1398,EDMO,2015-02-06,2020-09-28,False
145007,364,Galway Harbour Company (GHC),1398,EDMO,2015-02-06,2020-09-28,False
147346,3640,University at Albany (UAlbany),1398,EDMO,2015-02-06,2020-09-28,False
147347,3641,University Corporation for Atmospheric Research (UCAR),1398,EDMO,2015-02-06,2020-09-28,False
147348,3642,University-National Oceanographic Laboratory System (UNOLS),1398,EDMO,2015-02-06,2020-09-28,False
147349,3643,University of Alaska Fairbanks (UAF),1398,EDMO,2015-02-06,2020-09-28,False
147350,3644,University of Arizona (Arizona),1398,EDMO,2015-02-06,2020-09-28,False
147351,3645,University of California, Davis (UC Davis),1398,EDMO,2015-02-06,2020-09-28,False
147352,3646,University of California, Los Angeles (UCLA),1398,EDMO,2015-02-06,2020-09-28,False
147353,3647,University of Florida (Florida),1398,EDMO,2015-02-06,2020-09-28,False
147354,3648,University of Idaho (Idaho),1398,EDMO,2015-02-06,2020-09-28,False
147355,3649,University of Illinois at Chicago (UIC),1398,EDMO,2015-02-06,2020-09-28,False
147356,3650,University of Louisiana at Lafayette (Louisiana),1398,EDMO,2015-02-06,2020-09-28,False
147357,3651,University of Massachusetts, Amherst (UMass Amherst),1398,EDMO,2015-02-06,2020-09-28,False
147358,3652,University of Massachusetts, Boston (UMass Boston),1398,EDMO,2015-02-06,2020-09-28,False
147359,3653,University of Massachusetts, Dartmouth (UMass Dartmouth),1398,EDMO,2015-02-06,2020-09-28,False
147360,3654,University of Memphis (Memphis),1398,EDMO,2015-02-06,2020-09-28,False
147361,3655,University of Michigan (Michigan),1398,EDMO,2015-02-06,2020-09-28,False
147362,3656,University of Minnesota Duluth (UMD),1398,EDMO,2015-02-06,2020-09-28,False
147363,3657,University of Minnesota Twin Cities (UMTC),1398,EDMO,2015-02-06,2020-09-28,False
147364,3658,University of Missouri (Missouri),1398,EDMO,2015-02-06,2020-09-28,False
147365,3659,University of Nevada, Reno (UNR),1398,EDMO,2015-02-06,2020-09-28,False
145008,366,Geological Survey Ireland (GSI),1398,EDMO,2015-02-06,2020-09-28,False
147366,3660,University of North Carolina Chapel Hill (UNC),1398,EDMO,2015-02-06,2020-09-28,False
147367,3661,University of Oklahoma (OU),1398,EDMO,2015-02-06,2020-09-28,False
147368,3662,University of Pennsylvania (Penn),1398,EDMO,2015-02-06,2020-09-28,False
147369,3663,University of Rochester,1398,EDMO,2015-02-06,2020-09-28,False
147370,3664,University of South Alabama (USA),1398,EDMO,2015-02-06,2020-09-28,False
147371,3665,University of Tennessee Knoxville (UTK),1398,EDMO,2015-02-06,2020-09-28,False
147372,3666,University of Texas Institute for Geophysics (UTIG),1398,EDMO,2015-02-06,2020-09-28,False
147373,3667,University of Texas Marine Science Institute (UTMSI),1398,EDMO,2015-02-06,2020-09-28,False
147374,3668,University of Tulsa (Tulsa),1398,EDMO,2015-02-06,2020-09-28,False
147375,3669,University of Washington Television (UWTV),1398,EDMO,2015-02-06,2020-09-28,False
145009,367,Hensey Glan Uisce Teo,1398,EDMO,2015-02-06,2020-09-28,False
147376,3670,University of Wyoming (Wyoming),1398,EDMO,2015-02-06,2020-09-28,False
147377,3671,U.S. Army Corps of Engineers (USACE),1398,EDMO,2015-02-06,2020-09-28,False
147378,3672,Vanderbilt University (Vanderbilt),1398,EDMO,2015-02-06,2020-09-28,False
147379,3673,Vermont Law School (VLS),1398,EDMO,2015-02-06,2020-09-28,False
147380,3674,Washington State Department of Ecology (WaDoE),1398,EDMO,2015-02-06,2020-09-28,False
147381,3675,Washington State Department of Fish and Wildlife (WDFW),1398,EDMO,2015-02-06,2020-09-28,False
147382,3676,Washington State Department of Health (WaDoH),1398,EDMO,2015-02-06,2020-09-28,False
147383,3677,Western Environmental Technology Laboratories, Inc. (WET Labs),1398,EDMO,2015-02-06,2020-09-28,False
147384,3678,Williams College (Williams),1398,EDMO,2015-02-06,2020-09-28,False
147385,3679,Williamson and Associates (WA),1398,EDMO,2015-02-06,2020-09-28,False
145010,368,Irish Hydrodata Limited (Irish Hydrodata),1398,EDMO,2015-02-06,2020-09-28,False
147386,3680,Woods Hole Group (WHG),1398,EDMO,2015-02-06,2020-09-28,False
147387,3681,Yale University (Yale),1398,EDMO,2015-02-06,2020-09-28,False
147388,3682,Estonian Environmental board,1398,EDMO,2015-02-06,2020-09-28,False
147389,3683,MBT Underwater Technology (MBT),1398,EDMO,2015-02-06,2020-09-28,False
147390,3684,L-3 ELAC Nautik (ELAC),1398,EDMO,2015-02-06,2020-09-28,False
147391,3685,MMT Sweden AB,1398,EDMO,2015-02-06,2020-09-28,False
147392,3686,Aabenra Port,1398,EDMO,2015-02-06,2020-09-28,False
147393,3687,Port of Aalborg,1398,EDMO,2015-02-06,2020-09-28,False
147394,3688,Port of Esbjerg,1398,EDMO,2015-02-06,2020-09-28,False
147395,3689,Port of Hirtshals,1398,EDMO,2015-02-06,2020-09-28,False
145011,369,Kerry County Council (Kerry CC),1398,EDMO,2015-02-06,2020-09-28,False
147396,3690,Port of Horsens,1398,EDMO,2015-02-06,2020-09-28,False
147397,3691,Horsens Water A/S,1398,EDMO,2015-02-06,2020-09-28,False
147398,3692,Kalundborg Harbour,1398,EDMO,2015-02-06,2020-09-28,False
147399,3693,Kolding Port,1398,EDMO,2015-02-06,2020-09-28,False
147400,3694,Lemvig Port,1398,EDMO,2015-02-06,2020-09-28,False
147401,3695,Løgstør Port,1398,EDMO,2015-02-06,2020-09-28,False
147402,3696,Mariagerfjord Municipality,1398,EDMO,2015-02-06,2020-09-28,False
147403,3697,Nykøbing Mors Port,1398,EDMO,2015-02-06,2020-09-28,False
147404,3698,Port of Odense,1398,EDMO,2015-02-06,2020-09-28,False
147405,3699,Port of Skagen,1398,EDMO,2015-02-06,2020-09-28,False
144731,37,Pembrokeshire County Council,1398,EDMO,2015-02-06,2020-09-28,False
145012,370,Kinsale Harbour Commissioners (KHC),1398,EDMO,2015-02-06,2020-09-28,False
147406,3700,Skive Port,1398,EDMO,2015-02-06,2020-09-28,False
147407,3701,Thisted Port,1398,EDMO,2015-02-06,2020-09-28,False
147408,3702,Vejle Harbour,1398,EDMO,2015-02-06,2020-09-28,False
147409,3703,Vesterø Port,1398,EDMO,2015-02-06,2020-09-28,False
147410,3704,The HafenCity University Hamburg (HCU),1398,EDMO,2015-02-06,2020-09-28,False
147411,3705,Turo Technology Pty Ltd (Turo),1398,EDMO,2015-02-06,2020-09-28,False
147412,3706,Bermuda Institute of Ocean Sciences (BIOS),1398,EDMO,2015-02-06,2020-09-28,False
147413,3707,Bahamas Marine Mammal Research Organisation (BMMRO),1398,EDMO,2015-02-06,2020-09-28,False
147414,3708,AML Oceanographic (AML),1398,EDMO,2015-02-06,2020-09-28,False
147415,3709,Applanix Corp. (Applanix),1398,EDMO,2015-02-06,2020-09-28,False
147416,3710,Canadian Broadcasting Corporation (CBC),1398,EDMO,2015-02-06,2020-09-28,False
147417,3711,Canadian Ice Service (CIS),1398,EDMO,2015-02-06,2020-09-28,False
147418,3712,Canadian Navy (RCN),1398,EDMO,2015-02-06,2020-09-28,False
147419,3713,Canadian Scientific Submersible Facility (CSSF),1398,EDMO,2015-02-06,2020-09-28,False
147420,3714,Knudsen Engineering Ltd. (Knudsen),1398,EDMO,2015-02-06,2020-09-28,False
147421,3715,Marine Magnetics (Marine Magnetics),1398,EDMO,2015-02-06,2020-09-28,False
147422,3716,Ocean Networks Canada (ONC),1398,EDMO,2015-02-06,2020-09-28,False
147423,3717,ODIM Brooke Ocean (Brooke Ocean),1398,EDMO,2015-02-06,2020-09-28,False
147424,3718,Royal Roads University (RRU),1398,EDMO,2015-02-06,2020-09-28,False
147425,3719,Seaforth Geosurveys  (Seaforth ),1398,EDMO,2015-02-06,2020-09-28,False
145013,372,Mayo County Council (Mayo CC),1398,EDMO,2015-02-06,2020-09-28,False
147426,3720,Université du Québec à Montréal (UQAM),1398,EDMO,2015-02-06,2020-09-28,False
147427,3721,University of Ottawa (Ottawa),1398,EDMO,2015-02-06,2020-09-28,False
147428,3722,University of Western Ontario (Western),1398,EDMO,2015-02-06,2020-09-28,False
147429,3723,Simon Fraser University (SFU),1398,EDMO,2015-02-06,2020-09-28,False
147430,3724,Axys Technologies, Inc. (Axys),1398,EDMO,2015-02-06,2020-09-28,False
