tblCodeID,Code,Description,tblCodeTypeID,CodeType,Created,Modified,Deprecated
144695,1,University of Birmingham, Department of Geological Sciences,1398,EDMO,2015-02-06,2021-02-17,True
144704,10,University of Liverpool, Oceanographic Laboratories, Department of Earth Sciences,1398,EDMO,2015-02-06,2020-09-28,False
144794,100,Leibniz Institute for Baltic Sea Research Warnemünde (IOW),1398,EDMO,2015-02-06,2020-09-28,False
146664,1000,CQEL Dieppe, Service Territorial et Maritime (Ministere de l'Equipement, des Transport et du Logement),1398,EDMO,2015-02-06,2020-12-05,False
146665,1001,IFREMER, STATION D'ARCACHON,1398,EDMO,2015-02-06,2020-12-05,False
146666,1002,Aquitaine Observatory of Sciences of the Universe, University of Bordeaux (OASU) (OASU),1398,EDMO,2015-02-06,2020-12-05,False
146667,1003,Department of Agriculture and Rural Development for Northern Ireland,1398,EDMO,2015-02-06,2020-09-28,True
146668,1004,Hellenic Navy Hydrographic Service  (HNHS),1398,EDMO,2015-02-06,2020-11-03,False
146669,1006,APAT of Venice, ex Istituto Idrografico e Mareografico di Venezia,1398,EDMO,2015-02-06,2020-12-05,False
146670,1007,Comune di Venezia, Centro Previsioni e Segnalazioni Maree,1398,EDMO,2015-02-06,2020-12-05,False
146671,1008,APAT, Agency for Environmental Protection and Technical Services,1398,EDMO,2015-02-06,2020-12-05,True
146672,1009,CNR, Istituto per l'Ambiente Marino Costiero (Sezione di Oristano),1398,EDMO,2015-02-06,2020-09-28,False
144795,101,Alfred Wegener Institute Helmholtz Centre for Polar and Marine Research, Wadden Sea Station Sylt (AWI),1398,EDMO,2015-02-06,2020-09-28,False
146673,1010,ARPA Friuli-Venezia Giulia, Alto Adriatico Observatory (OAA),1398,EDMO,2015-02-06,2020-12-05,False
146674,1011,Venice Water Authority, Consorzio Venezia Nuova,1398,EDMO,2015-02-06,2020-12-05,False
146675,1014,The Ministry of National Defense, General Command of Mapping,1398,EDMO,2015-02-06,2020-09-28,False
146676,1015,Oceanologic Observatory of Banyuls (University of Paris VI), OSU (OSU-OOB),1398,EDMO,2015-02-06,2020-12-05,False
146677,1016,IFREMER, DYNECO- Coastal Environment Dynamics department (IFREMER / DYNECO),1398,EDMO,2015-02-06,2020-12-05,False
146678,1017,Societe ACRI S.A.,1398,EDMO,2015-02-06,2020-09-28,False
146679,1018,CEA,  Service Mixte De Surveillance Radiologique Et Biologique,1398,EDMO,2015-02-06,2020-12-05,False
146680,1019,Wimereux Marine Station (University of Sciences and Technologies of Lille 1),1398,EDMO,2015-02-06,2020-09-28,True
144796,102,Office of Schleswig-Holstein Wadden Sea National Park,1398,EDMO,2015-02-06,2020-09-28,False
146681,1020,CNRS, COM, Physical and Biogeochemical Oceanography Laboratory (Toulon) (LOPB),1398,EDMO,2015-02-06,2020-12-05,True
146682,1022,BRGM, Office of Geological and Mining Resources,1398,EDMO,2015-02-06,2020-12-05,False
146683,1023,CETE NORMANDIE CENTRE (Ministere de l'Equipement, des Transport et du Logement),1398,EDMO,2015-02-06,2020-09-28,False
146684,1024,IGN, Département des grands clients (Institut Geographique National),1398,EDMO,2015-02-06,2020-12-05,False
146685,1026,MUSEUM NATIONAL D'HISTOIRE NATURELLE, UNITE INVENTAIRE ET SUIVI DE LA BIODIVERSITE  (ISB),1398,EDMO,2015-02-06,2020-12-15,False
146686,1027,UNIVERSITE DE MONTPELLIER II, LABORATOIRE DE GEOPHYSIQUE ET D'HYDRODYNAMIQUE EN FORAGE,1398,EDMO,2015-02-06,2020-12-05,False
146687,1028,BRGM/GEO, Geology service, Mapping and geoinformation,1398,EDMO,2015-02-06,2020-12-05,False
146688,1029,École Normale Supérieure Institute of Marine Biogeochemistry,1398,EDMO,2015-02-06,2020-09-28,False
144797,103,University of Hamburg, Institute of Meteorology,1398,EDMO,2015-02-06,2020-09-28,False
146689,1031,IFREMER, CENTRE MANCHE, MER DU NORD,1398,EDMO,2015-02-06,2020-12-05,False
146690,1032,Black Sea Basin Directorate,1398,EDMO,2015-02-06,2020-09-28,False
146691,1033,University of Antwerp, Department of Biology, Ecosystem Management Research Group,1398,EDMO,2015-02-06,2020-09-28,False
146692,1034,Euras,1398,EDMO,2015-02-06,2020-09-28,False
146693,1035,Université Catholique de Louvain, Marine Biology Laboratory,1398,EDMO,2015-02-06,2020-12-05,False
146694,1036,Resource Analysis,1398,EDMO,2015-02-06,2020-09-28,False
146695,1037,University of Antwerp, Department of Biology, Laboratory for Ecophysiology, Biochemistry and Toxicology,1398,EDMO,2015-02-06,2020-09-28,False
146696,1038,CEA, DEPT DASE, SERVICE TMG,1398,EDMO,2015-02-06,2020-12-15,False
146697,1039,CEA, INSTITUT DE  RADIOPROTECTION ET DE SURETE NUCLEAIRE,1398,EDMO,2015-02-06,2020-12-05,False
144798,104,State Office for Water Economy and Shore, Schleswig-Holstein, Kiel,1398,EDMO,2015-02-06,2020-09-28,True
146698,1040,CETE, CETE AIX,1398,EDMO,2015-02-06,2020-12-05,False
146699,1041,CNEVA, LAB. PATHOLOGIE ANIMAUX AQUATIQUES,1398,EDMO,2015-02-06,2020-12-05,False
146700,1042,CNRS, INSU TECHNICAL DIVISION, UPS855, PLOUZANÉ (DT INSU),1398,EDMO,2015-02-06,2020-12-05,False
146701,1043,COM, Physical and Biogeochemical Oceanography Laboratory (Endoume) (LOPB),1398,EDMO,2015-02-06,2020-12-05,False
146702,1044,CNRS, INST. DE GEODYNAMIQUE (SOPHIA ANTIPOLIS),1398,EDMO,2015-02-06,2020-12-05,False
146703,1045,CNRS, INSTITUT PIERRE SIMON LAPLACE  (IPSL),1398,EDMO,2015-02-06,2020-12-05,False
146704,1046,CNRS, LABORATORY OF SCIENCES OF MARINE ENVIRONMENT (LEMAR),1398,EDMO,2015-02-06,2020-12-05,False
146705,1047,CREOCEAN, CREOCEAN (CREOCEAN),1398,EDMO,2015-02-06,2020-12-05,False
146706,1048,DIR. DEPARTEMENTALE EQUIPEMENT FINISTERE,1398,EDMO,2015-02-06,2020-09-28,False
146707,1049,DIR. DEPARTEMENTALE EQUIPEMENT MORBIHAN,1398,EDMO,2015-02-06,2020-09-28,False
144799,105,Coastal Research Station of the NLOE (CRS),1398,EDMO,2015-02-06,2020-11-03,False
146708,1050,DIR. DEPARTEMENTALE EQUIPEMENT VENDEE,1398,EDMO,2015-02-06,2020-09-28,False
146709,1051,UNKNOWN,1398,EDMO,2015-02-06,2020-09-28,False
146710,1052,GENAVIR BREST,1398,EDMO,2015-02-06,2020-09-28,False
146711,1053,IFREMER, GENAVIR LA SEYNE SUR MER,1398,EDMO,2015-02-06,2020-12-05,False
146712,1054,IFREMER Head Office,1398,EDMO,2015-02-06,2020-09-28,False
146713,1056,IFREMER, STATION DE LA TREMBLADE,1398,EDMO,2015-02-06,2020-12-05,False
146714,1057,IFREMER, TSI/AS- ACOUSTIC SEISMIC (IFREMER / TSI / AS),1398,EDMO,2015-02-06,2020-12-05,False
146715,1059,French Petroleum Institute New Energies, Rueil-Malmaison (IFPEN),1398,EDMO,2015-02-06,2020-12-05,False
144800,106,Alfred Wegener Institute Helmholtz Centre for Polar and Marine Research, Geophysics Department (AWI),1398,EDMO,2015-02-06,2020-09-28,False
146716,1060,INSTITUT GEOGRAPHIQUE NATIONAL, ECOLE NATIONALE DES SCIENCES GEOGRAPHIQUES, IGN (ENSG),1398,EDMO,2015-02-06,2020-12-05,False
146717,1061,FUGRO FRANCE SA,1398,EDMO,2015-02-06,2020-09-28,False
146718,1062,IRD, CENTRE DE CAYENNE- GUYANE,1398,EDMO,2015-02-06,2020-12-05,False
146719,1063,IRD, CENTRE DE LA MARTINIQUE,1398,EDMO,2015-02-06,2020-12-05,False
146720,1064,IRD, CENTRE DE LA REUNION,1398,EDMO,2015-02-06,2020-12-05,False
146721,1065,IRD, CENTRE DE MONTPELLIER,1398,EDMO,2015-02-06,2020-12-05,False
146722,1066,IRD, CENTRE DE PAPEETE,1398,EDMO,2015-02-06,2020-12-05,False
146723,1067,IRD, CENTRE TOGA LE HAVRE,1398,EDMO,2015-02-06,2020-12-05,True
146724,1068,ISTPM (IFREMER NANTES),1398,EDMO,2015-02-06,2020-09-28,True
146725,1069,METEO FRANCE, Centre Meteorologique Nevers,1398,EDMO,2015-02-06,2020-12-05,True
144801,107,Alfred Wegener Institute Helmholtz Centre for Polar and Marine Research, Nutrient Group (AWI),1398,EDMO,2015-02-06,2020-09-28,False
146726,1070,National Center for Meteorological Research (Paris) (CNRM),1398,EDMO,2015-02-06,2020-09-28,False
146727,1071,SESAM, SESAM,1398,EDMO,2015-02-06,2020-12-05,False
146728,1072,UNIV. SCIENCES et TECHNOLOGIES DE LILLE 1, LABORATOIRE SEDIMENTOLOGIE ET GEOCHIMIE,1398,EDMO,2015-02-06,2020-12-05,True
146729,1073,UNIVERSITE D'ORLEANS, LABORATOIRE GEOLOGIE DYNAMIQUE ORLEANS,1398,EDMO,2015-02-06,2020-12-05,False
146730,1074,University of Bordeaux I, Center for study of tropical geography (CEGET),1398,EDMO,2015-02-06,2020-12-05,False
146731,1075,University of Bordeaux I, IGBA Talence (IGBA),1398,EDMO,2015-02-06,2020-12-05,False
146732,1076,University of Bordeaux I, Amenagement institute,1398,EDMO,2015-02-06,2020-12-05,False
146733,1077,University of Bordeaux I, Marine Biology Institut,1398,EDMO,2015-02-06,2020-12-05,False
146734,1079,Ocean Geoscience Laboratory, UMR 6538 (LGO),1398,EDMO,2015-02-06,2020-12-05,False
144802,108,CNR, Istituto di Scienze Marine (Sezione di Venezia, ex IBM),1398,EDMO,2015-02-06,2020-12-05,False
146735,1081,UNIVERSITE DE BRETAGNE-SUD, GEOSCIENCES, LAUBS (UBS),1398,EDMO,2015-02-06,2020-12-05,False
146736,1082,UNIVERSITE DE CORSE, CEVAREN,1398,EDMO,2015-02-06,2020-12-05,False
146737,1083,UNIVERSITY OF GRENOBLE 1, Laboratory of Geophysical and Industrial Flows, UMR 5519 (LEGI),1398,EDMO,2015-02-06,2020-12-05,False
146738,1084,UNIVERSITE DE LA MEDITERRANNEE (U2), CENTRE D'OCEANOLOGIE DE MARSEILLE,1398,EDMO,2015-02-06,2020-12-05,True
146739,1085,UNIVERSITE DE LA MEDITERRANNEE (U2), EQUIPE INTEC, COM,1398,EDMO,2015-02-06,2020-12-05,False
146740,1086,UNIVERSITE DE LA MEDITERRANNEE (U2), LABORATOIRE D'HYDROBIOLOGIE MARINE,1398,EDMO,2015-02-06,2020-12-05,False
146741,1087,UNIVERSITE DE MONTPELLIER II, LABORATOIRE DE GEOPHYSIQUE ET TECTONIQUE,1398,EDMO,2015-02-06,2020-12-05,False
146742,1088,GEOSCIENCES MONTPELLIER, UMR 5243 (GM),1398,EDMO,2015-02-06,2020-12-05,False
146743,1089,UNIVERSITE DE NANTES, LAB.DE GEOLOGIE MARINE ET APPLIQUEE,1398,EDMO,2015-02-06,2020-12-05,False
146744,1090,UNIVERSITE DE NANTES, LABORATOIRE DE PETROLOGIE STRUCTURALE,1398,EDMO,2015-02-06,2020-12-05,False
146745,1092,UNIVERSITE DE PARIS VI, LABORATOIRE DE GEOLOGIE DYNAMIQUE PARIS,1398,EDMO,2015-02-06,2020-12-05,False
146746,1094,UNIVERSITE DE PAU, LAB.CHIMIE BIO INORGANIQUE & ENVIRONNEMENT,1398,EDMO,2015-02-06,2020-12-05,False
146747,1095,UNIVERSITY RENNES I, Rennes GEOSCIENCES, UMR CNRS 6118 (Géosciences Rennes),1398,EDMO,2015-02-06,2020-12-05,False
146748,1096,UNIVERSITY OF ROUEN, Laboratory of Continental and Coastal Morphodynamics, UMR 6143 (MC2) (MC2),1398,EDMO,2015-02-06,2020-12-05,False
146749,1097,University of Strasbourg I (Louis Pasteur), Earth Sciences School and Observatory (EOST),1398,EDMO,2015-02-06,2020-12-05,False
146750,1098,Department of Biological and Environmental Sciences, Aquatic Sciences, University of Helsinki,1398,EDMO,2015-02-06,2020-09-28,False
146751,1099,Technical University of Denmark, DTU Environment, Department of Environmental Engineering.,1398,EDMO,2015-02-06,2020-09-28,False
144705,11,University Marine Biological Station, Millport (UMBSM),1398,EDMO,2015-02-06,2020-09-28,False
144803,110,ENEA Centro Ricerche, Frascati,1398,EDMO,2015-02-06,2020-12-05,False
146752,1102,Danish Institute for Fisheries Research, Dept. of Marine Fisheries,1398,EDMO,2015-02-06,2020-09-28,False
146753,1103,Aarhus University, Department of Bioscience,Wildlife Ecology and Biodiversity,1398,EDMO,2015-02-06,2020-09-28,False
146754,1104,Finnish Environment Institute (SYKE),1398,EDMO,2015-02-06,2021-06-25,False
146755,1105,English Nature,1398,EDMO,2015-02-06,2020-09-28,True
146756,1106,Scottish Natural Heritage, Edinburgh (SNH),1398,EDMO,2015-02-06,2021-02-05,True
146757,1107,Countryside Council for Wales (CCW),1398,EDMO,2015-02-06,2020-09-28,True
146758,1108,Northern Ireland Environment Agency (NIEA),1398,EDMO,2015-02-06,2020-09-28,False
146759,1109,Queens University Belfast, Department of Agriculture and Environmental Science (QUB),1398,EDMO,2015-02-06,2020-12-05,False
144804,111,Federal Maritime and Hydrographic Agency, Dept. Ocean Currents,1398,EDMO,2015-02-06,2020-09-28,False
146760,1110,Channel Coastal Observatory (CCO),1398,EDMO,2015-02-06,2020-09-28,False
146761,1111,Icelandic Maritime Administration (IMA),1398,EDMO,2015-02-06,2020-09-28,True
146762,1112,Icelandic Coast Guard Hydrographic Department (ICGHD),1398,EDMO,2015-02-06,2020-09-28,False
146763,1113,UNIFOB AS,1398,EDMO,2015-02-06,2020-09-28,True
146764,1114,Municipality of Landskrona,1398,EDMO,2015-02-06,2020-09-28,False
146765,1115,Institute of Ecology of Nature Research Centre,1398,EDMO,2015-02-06,2020-09-28,False
146766,1116,Lithuanian State Pisciculture and Fisheries Research Center, Fishery Research Laboratory,1398,EDMO,2015-02-06,2020-09-28,False
146767,1117,Coastal Research and Planning Institute,1398,EDMO,2015-02-06,2020-09-28,False
146768,1118,Central Laboratory of Geodesy,1398,EDMO,2015-02-06,2020-09-28,False
146769,1119,Hydrographic service, Naval forces, Hydrographic Department,1398,EDMO,2015-02-06,2020-12-05,False
144805,112,Federal Maritime and Hydrographic Agency, Dept. Operational Modelling,1398,EDMO,2015-02-06,2020-09-28,False
146770,1120,Regional Inspection of Environment and Waters, Varna,1398,EDMO,2015-02-06,2020-09-28,False
146771,1121,Regional Inspection of Environment and Waters, Burgas,1398,EDMO,2015-02-06,2020-09-28,False
146772,1122,Geological Institute, Department of Marine Geology,1398,EDMO,2015-02-06,2020-09-28,False
146773,1123,State Hydrographical Service of Georgia,1398,EDMO,2015-02-06,2020-09-28,False
146774,1124,Kolkheti (City of Poti) Hydrographical Observatory (Deltaic) of the Department of Hydrometeorology of Georgia,1398,EDMO,2015-02-06,2020-09-28,True
146775,1125,Poti  Sea Port Ltd. (PSP),1398,EDMO,2015-02-06,2020-09-28,False
146776,1126,Marine Institute (Newport Facility) (MI),1398,EDMO,2015-02-06,2020-09-28,False
146777,1128,National Agricultural Research Foundation, Fisheries Research Institute,1398,EDMO,2015-02-06,2020-09-28,False
146778,1129,National Center for Meteorology and Aeronautical Climatology,1398,EDMO,2015-02-06,2020-09-28,False
144806,113,Federal Maritime and Hydrographic Agency, Dept. Tides,1398,EDMO,2015-02-06,2020-09-28,False
146779,1130,ARPA Emilia-Romagna, Struttura Oceanografica Daphne,1398,EDMO,2015-02-06,2020-12-05,False
146780,1131,CNR, Istituto per l'Ambiente Marino Costiero (Sezione di Messina),1398,EDMO,2015-02-06,2015-06-26,False
146781,1132,ARPA Veneto, Centro Meteorologico di Teolo,1398,EDMO,2015-02-06,2020-12-05,False
146782,1133,General Office for Air Force Meteorology,1398,EDMO,2015-02-06,2020-09-28,False
146783,1134,Provincia di Sassari,1398,EDMO,2015-02-06,2020-09-28,False
146784,1135,Royal Danish Navy,1398,EDMO,2015-02-06,2020-09-28,False
146785,1138,Experimental Branch of Marine Hydrophysical Institute,1398,EDMO,2015-02-06,2020-09-28,False
146786,1139,Municipal Water and Sewerage Enterprise of Volos Greater Area  (DEYAMV),1398,EDMO,2015-02-06,2020-11-03,False
144807,114,Federal Maritime and Hydrographic Agency, Dept. Waves,1398,EDMO,2015-02-06,2020-09-28,False
146787,1140,Tsivos Laboratories, Examination center of quality for water and foods,1398,EDMO,2015-02-06,2020-12-05,False
146788,1141,Sønderjyllands Amt,1398,EDMO,2015-02-06,2020-09-28,True
146789,1142,Bornholms Regionskommune,1398,EDMO,2015-02-06,2020-09-28,True
146790,1143,Ringkjøbing Amt,1398,EDMO,2015-02-06,2020-09-28,True
146791,1144,IRD, CENTRE OF MADAGASCAR,1398,EDMO,2015-02-06,2020-12-05,False
146792,1145,IRD, CENTRE OF ABIDJAN,1398,EDMO,2015-02-06,2020-12-05,False
146793,1146,IRD, CENTRE OF POINTE NOIRE,1398,EDMO,2015-02-06,2020-12-05,False
146794,1147,IRD, CENTRE OF HANN,1398,EDMO,2015-02-06,2020-12-05,False
146795,1148,IRD, CENTRE OF JAKARTA,1398,EDMO,2015-02-06,2020-12-05,False
146796,1149,UNESCO/Intergovernmental Oceanographic Commission Project Office for IODE (IOC-IODE),1398,EDMO,2015-02-06,2020-09-28,False
144808,115,GEOMAR Research Centre for Marine Geosciences,1398,EDMO,2015-02-06,2020-09-28,True
146797,1150,National office for environment and nature Stralsund,1398,EDMO,2015-02-06,2020-09-28,False
146798,1151,Max-Planck Institute for Marine Microbiology,1398,EDMO,2015-02-06,2020-09-28,False
146799,1152,Centre for Environmental Research  (UFZ),1398,EDMO,2015-02-06,2020-11-03,False
146800,1153,Institute for Hydrobiology and Fisheries Science, University of Hamburg,1398,EDMO,2015-02-06,2020-09-28,True
146801,1154,Westfaelische Wilhelms, University of Muenster,1398,EDMO,2015-02-06,2020-12-05,False
146802,1155,Johannes Gutenberg University Mainz,1398,EDMO,2015-02-06,2020-09-28,False
146803,1156,University of Hamburg, Institute of Oceanography (IfM),1398,EDMO,2015-02-06,2020-09-28,False
146804,1157,University of Bremen,1398,EDMO,2015-02-06,2020-09-28,False
146805,1158,Technical University of Berlin,1398,EDMO,2015-02-06,2020-09-28,False
146806,1159,Institute and Museum for Geology and Paleontology, University of Tuebingen,1398,EDMO,2015-02-06,2020-09-28,False
144809,116,Baltic Sea Research Institute Warnemuende, Marine Geology Department (IOW),1398,EDMO,2015-02-06,2020-09-28,False
146807,1160,Institute for Marine Science (IFM), University of Kiel (IFM),1398,EDMO,2015-02-06,2020-09-28,True
146808,1161,Research Centre Juelich GmbH,1398,EDMO,2015-02-06,2020-09-28,False
146809,1162,Technical University of Munich, Lehrstuhl fuer Bioklimatologie und Immissionsforschung,1398,EDMO,2015-02-06,2020-09-28,False
146810,1163,SIMORC service,1398,EDMO,2015-02-06,2020-09-28,False
146811,1164,Technical University Varna,1398,EDMO,2015-02-06,2020-09-28,False
146812,1165,Black Sea NGO Network,1398,EDMO,2015-02-06,2020-09-28,False
146813,1167,Ukrainian scientific center of Ecology of Sea  (UkrSCES),1398,EDMO,2015-02-06,2020-11-03,False
146814,1168,Scientific Research Institute of Ecological Problems  (USRIEP),1398,EDMO,2015-02-06,2020-11-03,False
146815,1169,Odessa National I.I.Mechnikov University,1398,EDMO,2015-02-06,2020-09-28,False
144810,117,Federal Maritime and Hydrographic Agency, Dept. Oceanography,1398,EDMO,2015-02-06,2020-09-28,False
146816,1171,Bulgarian Cartographic Service,1398,EDMO,2015-02-06,2020-09-28,False
146817,1173,Hapag-Lloyd AG,1398,EDMO,2015-02-06,2020-09-28,False
146818,1174,Hamburg SUED,1398,EDMO,2015-02-06,2020-09-28,False
146819,1175,Federal Ministry of Food, Agriculture and Consumer Protection  (BMELV),1398,EDMO,2015-02-06,2020-11-03,False
146820,1176,Bundesamt fur Landwirtschaft und Ernahrung  (BLE),1398,EDMO,2015-02-06,2020-11-03,False
146821,1177,Water- and Shipping Directorate North  (WSD North),1398,EDMO,2015-02-06,2020-11-03,False
146822,1178,Waterways and Shipping Office Cuxhaven,1398,EDMO,2015-02-06,2020-09-28,False
146823,1179,Waterways and Shipping Office Bremerhaven  (WSA-Bremerhaven),1398,EDMO,2015-02-06,2020-11-03,False
146824,1180,Water and Shipping Directorate Northwest,1398,EDMO,2015-02-06,2020-09-28,False
146825,1181,State Agency for Nature and Environment of Schleswig Holstein  (LANU),1398,EDMO,2015-02-06,2020-11-03,True
146826,1182,Waterways and Shipping Office Toenning  (WSA-Toenning),1398,EDMO,2015-02-06,2020-11-03,False
146827,1183,Federal Environment AgencyEnvironmental Specimen Bank  (ESB),1398,EDMO,2015-02-06,2020-11-03,False
146828,1185,Kaabeltau OÜ,1398,EDMO,2015-02-06,2020-09-28,False
146829,1186,AS Julanta,1398,EDMO,2015-02-06,2020-09-28,True
146830,1187,The Finnish Game and Fisheries Research Institute  (FGFRI),1398,EDMO,2015-02-06,2020-11-03,False
146831,1188,Finnlines Plc,1398,EDMO,2015-02-06,2020-09-28,False
146832,1189,Centre National d'Etudes Spatiales  (CNES),1398,EDMO,2015-02-06,2020-11-03,False
144811,119,University of Trieste, Department of Geological, Environmental and Marine Sciences,1398,EDMO,2015-02-06,2020-09-28,True
146833,1190,METEO FRANCE, Centre de Météorologie Marine (CMM),1398,EDMO,2015-02-06,2020-12-05,False
146834,1192,Service Maritime et de Navigation du Languedoc, Roussillon  (SMNLR),1398,EDMO,2015-02-06,2020-12-05,False
146835,1198,IGN France International,1398,EDMO,2015-02-06,2020-09-28,False
144706,12,University of Newcastle upon Tyne,Department of Physics,1398,EDMO,2015-02-06,2020-09-28,False
144812,120,National Institute of Oceanography and Applied Geophysics - OGS, Division of Oceanography,1398,EDMO,2015-02-06,2021-05-14,False
146836,1200,Centre d'Etudes Techniques Maritimes et Fluviales  (CETMEF),1398,EDMO,2015-02-06,2020-11-03,True
146837,1201,Muir Matheson,1398,EDMO,2015-02-06,2020-09-28,False
146838,1202,National Observatory of Athens, Institute for Space Applications & Remote Sensing  (NOA/ISARS),1398,EDMO,2015-02-06,2020-11-03,False
146839,1204,P&O Maritime Services (Ireland) (P&O),1398,EDMO,2015-02-06,2020-09-28,False
146840,1205,Israel Electric Company,1398,EDMO,2015-02-06,2020-09-28,False
146841,1206,CNR, Istituto di Studi sui Sistemi Intelligenti per l'Automazione (Sezione di Genova),1398,EDMO,2015-02-06,2020-09-28,False
146842,1207,ARPA Veneto, Osservatorio Regionale Acque,1398,EDMO,2015-02-06,2020-12-05,False
146843,1208,ARPA Emilia-Romagna, Servizio Meteorologico Regionale,1398,EDMO,2015-02-06,2020-12-05,False
146844,1209,CNR, Istituto di Scienze Marine (Sezione di Venezia, ex ISDGM),1398,EDMO,2015-02-06,2020-12-05,False
144813,121,Universita' di Venezia, Dipartimento di Scienze Ambientali, Sezione Geo-Mineralogica,1398,EDMO,2015-02-06,2020-09-28,False
146845,1210,Italian Ministry of Environment, Sea Protection Service  (SiDiMar),1398,EDMO,2015-02-06,2020-12-05,False
146846,1211,ARPA Lazio,1398,EDMO,2015-02-06,2020-09-28,False
146847,1212,Norwegian Meteorological Institute,1398,EDMO,2015-02-06,2020-09-28,False
146848,1213,Swedish Coast Guard (KBV),1398,EDMO,2015-02-06,2020-09-28,False
146849,1214,TT Line,1398,EDMO,2015-02-06,2020-09-28,False
146850,1215,Swedish Maritime Administration,1398,EDMO,2015-02-06,2020-09-28,False
146851,1216,AS Tallink Grupp,1398,EDMO,2015-02-06,2020-09-28,False
146852,1217,Swedish Armed Forces,1398,EDMO,2015-02-06,2020-09-28,False
146853,1218,Stena Line,1398,EDMO,2015-02-06,2020-09-28,False
144814,122,ENEL SPA, Centro Ricerca Idraulica e Strutturale (CRIS), Servizio Idrologico,1398,EDMO,2015-02-06,2020-12-05,False
146854,1221,Laboratory of Oceanography, Lebanese University,1398,EDMO,2015-02-06,2020-09-28,False
146855,1224,National Aeronautics and Space Administration Jet Propulsion Laboratory  (NASA JPL),1398,EDMO,2015-02-06,2020-09-28,False
146856,1225,National Aeronautics and Space Administration Goddard Space Flight Center (NASA GSFC),1398,EDMO,2015-02-06,2020-09-28,False
146857,1226,National Oceanic and Atmospheric Administration, National Environmental Satellite, Data, and Information Service (NOAA NESDIS),1398,EDMO,2015-02-06,2020-12-05,False
146858,1228,Polytechnic University of Tirana, Institute of GeoSciences, Energy, Water and Environment (IGEWE - PUT),1398,EDMO,2015-02-06,2020-12-05,False
146859,1229,National Institute of Biology, Marine Biology Station (NIB),1398,EDMO,2015-02-06,2021-06-16,False
144815,123,CNR, Istituto di Ricerca sulle Acque,1398,EDMO,2015-02-06,2020-09-28,False
146860,1230,National Center for Marines Sciences, NCMS,1398,EDMO,2015-02-06,2020-12-05,False
146861,1231,Ecole Nationale Superieure des Sciences de la Mer et de l Amenagement du Littoral, ENSSMAL,1398,EDMO,2015-02-06,2020-12-05,False
146862,1232,Institut National des Sciences et Technologies de la Mer, INSTM,1398,EDMO,2015-02-06,2020-12-05,False
146863,1233,Collecte Localisation Satellites SA, CLS,1398,EDMO,2015-02-06,2020-12-05,False
146864,1235,Shell International Exploration & Production BV,1398,EDMO,2015-02-06,2020-09-28,False
146865,1236,TOTAL S.A.,1398,EDMO,2015-02-06,2020-09-28,False
146866,1237,Institute of Hydroengineering, Polish Academy of Sciences, Department of Wave Mechanics and Structural Dynamics (IBW PAN),1398,EDMO,2015-02-06,2020-12-05,False
146867,1238,Institute of Hydroengineering, Polish Academy of Science, Department of Coastal Engineering and Dynamics (IBW PAN),1398,EDMO,2015-02-06,2020-12-05,False
146868,1239,Institute of Hydroengineering, Polish Academy of Sciences, Department of Hydrodynamics of Rivers and Water Reservoirs (IBW PAN),1398,EDMO,2015-02-06,2020-12-05,False
144816,124,CNR, National Research Council, Institute of Marine Science, Lesina (CNR - ISMAR),1398,EDMO,2015-02-06,2020-12-24,True
146869,1240,Maritime Institute in Gdansk, Department of Environment Protection (MIG),1398,EDMO,2015-02-06,2020-12-05,False
146870,1241,Maritime Institute in Gdansk, Department of Operational Oceanography (MIG),1398,EDMO,2015-02-06,2020-12-05,False
146871,1242,Maritime Office in Gdynia,1398,EDMO,2015-02-06,2020-09-28,False
146872,1243,Maritime Office in Szczecin,1398,EDMO,2015-02-06,2020-09-28,False
146873,1244,Maritime Office in Slupsk,1398,EDMO,2015-02-06,2020-09-28,False
146874,1245,Medical University of Gdansk, Interfaculty Institute of Maritime and Tropical Medicine,1398,EDMO,2015-02-06,2020-09-28,False
146875,1246,Voivodship Sanitary and Epidemiological Station in Gdansk,1398,EDMO,2015-02-06,2020-09-28,False
146876,1247,Regional Inspectorate of Environmental Protection in Gdansk,1398,EDMO,2015-02-06,2020-09-28,False
146877,1248,Regional Inspectorate of Environmental Protection in Gdansk, Branch Office in Slupsk,1398,EDMO,2015-02-06,2020-12-05,False
146878,1249,Regional Inspectorate of Environmental Protection in Olsztyn,1398,EDMO,2015-02-06,2020-09-28,False
144817,125,Telespazio s.p.a., Earth Observation Division,1398,EDMO,2015-02-06,2020-12-05,False
146879,1250,Regional Inspectorate of Environmental Protection in Olsztyn, Branch Office in Elblag,1398,EDMO,2015-02-06,2020-12-05,False
146880,1251,Regional Inspectorate of Environmental Protection in Szczecin,1398,EDMO,2015-02-06,2020-09-28,False
146881,1252,Regional Inspectorate of Environmental Protection in Szczecin, Branch in Koszalin,1398,EDMO,2015-02-06,2020-12-05,False
146882,1253,Sea Fisheries Institute in Gdynia, Department of Fish Resources (SFI),1398,EDMO,2015-02-06,2020-12-05,False
146883,1254,Sea Fisheries Institute in Gdynia, Department of Fisheries Oceanography and Marine Ecology (SFI),1398,EDMO,2015-02-06,2020-12-05,False
146884,1255,Gdansk University of Technology, Faculty of Chemistry,1398,EDMO,2015-02-06,2020-09-28,False
146885,1256,Gdansk University of Technology, Faculty of Ocean Engineering and Ship Technology,1398,EDMO,2015-02-06,2020-09-28,False
146886,1257,Gdansk University of Technology, Faculty of Civil and Environmental Engineering,1398,EDMO,2015-02-06,2020-09-28,False
